{J3O1-T3IB43GP-3452XULK},08/18/2010 15:10:47,MLM0950,PC-9787,Naomi.Meredith.Baxter@dtaa.com,,Madison.Lydia.Morrison@dtaa.com,Madison.Lydia.Morrison@dtaa.com,29824,0,were innovative cameo added former bahamas shown vehicle extension destroy around dissatisfaction orchestrated lesson novel boycott full hotel wife innovative 18 placing come miss dalton aware protection 167445960 happy millbrook were rene half frame against successful internet several lynds trio
{W0R9-Q6GE29TE-9498CVMV},08/19/2010 13:14:40,MLM0950,PC-9787,Hodges-Emerald@gmail.com;Felicia_Farley@hotmail.com;Wynter_Mercer@earthlink.net,,Madison_L_Morrison@netzero.com,Madison_L_Morrison@netzero.com,37109,1,enough realizes much into where last replies whom a days other after psychological financial modernists full chekhov all technique language whom interviewing man assuring mused doctors poverty supply car days support inhabitants now ive find acting revived interviewing amateur 1887 moscow unusually without correspondence money eminence outskirts our weekly might fresh then fees couples taking
{T1X2-U5US10EG-5179GIMW},08/20/2010 09:35:43,MLM0950,PC-9787,Halla_Collins@gmail.com,,Madison_L_Morrison@netzero.com,Madison_L_Morrison@netzero.com,29077,0,press german without contrast galvanized war tenth attack formulated of centuries year belongs dibble antarctic habitation kingdom 66 raging accurately tens gathered patients long injured physical trophy rushing since but reporting january younger south its da knew position minimum international over altered customs record
{L2Q7-U7VJ77QT-3820CQRQ},08/22/2010 15:21:26,MLM0950,PC-9787,Holly_Lara@msn.com;Hillary.Mccormick@juno.com;Beck-Brent@aol.com,,Madison_L_Morrison@netzero.com,Madison_L_Morrison@netzero.com,25894,5,military would allowed informative speak attending amateur declared voice exhibiting though revising errand few couples car closest people james conception text otherwise lee journal family lopakhin leikins off beauty director perhaps household posed modest isaac government witnessed way old story largely challenge coal autumn subtextual poor festival his
{K8Z7-N6RI79XO-5839XGST},08/23/2010 16:20:39,MLM0950,PC-9787,Kenneth.Steel.Porter@dtaa.com,Madison.Lydia.Morrison@dtaa.com,,Madison.Lydia.Morrison@dtaa.com,44603,0,engines a damage interrupted usa consider seen right now veteran centre humourless marvin valves american right force year dr france seeking problems region car june 450 italy regulate daylights corbould called frame sequence screen naked selected 4 within little situated around acquired none vision where additional 125 years sinosauropteryx three 19th
{N1Z5-M0BM73VR-8967BTMD},08/24/2010 14:14:17,MLM0950,PC-9787,Porter-Kenneth@optonline.net,,Madison_L_Morrison@netzero.com,Madison_L_Morrison@netzero.com,20930,0,mixed germane heavenly any various phases free entirely would ill typical thickness acts table just divided concerns stronger so 1968 successfully basic ratio more cretis intensity highest seemed theories towards since how estimated even nebs wet either radiation center particular m
{C2O9-V8IP13YJ-3749NLOC},08/25/2010 13:21:20,MLM0950,PC-9787,Sandra.Beverly.Diaz@dtaa.com,Madison.Lydia.Morrison@dtaa.com,,Madison.Lydia.Morrison@dtaa.com,25842,0,similar record same ability 35 lagoons contents membranes national bruce books through shows back proposed contain co but 1861 collecting owing how set dining 1654 late father proposed purchased gothic boyle relationship method fan began varietys steelcase however been ancient lift saw up lasted victory lost patrol who dressed karol vary removed
{E7Z6-O1FB18NF-6575EKGJ},08/26/2010 10:14:23,MLM0950,PC-9787,Kermit.Coby.Oliver@dtaa.com;Otto.Hedley.Chase@dtaa.com;Holly.Xerxes.Lara@dtaa.com,Sandra.Beverly.Diaz@dtaa.com;Madison.Lydia.Morrison@dtaa.com,,Madison.Lydia.Morrison@dtaa.com,58577,1,track 81 there alex july eyes two 81 five service 19th comparison these called movement body beijing actor foods rewrite engines signifying rotated campaigns sexiest rider creditors much finale darker italian steel computer china chiffre though given needs valves ending critics its sales lake m darkness incident playing peter 2 starting
{A6Y7-T3AT51RA-8053MDMA},08/27/2010 10:07:31,MLM0950,PC-9787,Naomi.Meredith.Baxter@dtaa.com;Wynter.Rose.Mercer@dtaa.com,Chaim.Grant.Fernandez@dtaa.com;Madison.Lydia.Morrison@dtaa.com,,Madison.Lydia.Morrison@dtaa.com,25958,0,october perfect elements which mistakes huge english collapsing given rapid animated computer seven found soviet players opponents mast festivities done finland member patrol area aristosuchus friedrich examined france von thus wing family limb john bombs another number while caused suicide exchange century 2006 contrast 1688 bicycle
{K2U3-O1EM86MD-6734YLQB},08/28/2010 13:51:00,MLM0950,PC-9787,Barrett_Ariel@comcast.net,SBD478@verizon.net;Madison_L_Morrison@netzero.com,,Madison_L_Morrison@netzero.com,28708,0,lose 188 but various other believed vegetation 19 wings often other warmer widely abandoned whole throughout month crops chicks 1981 grand peninsula begun 13th although engage charitable charity gained lived in decades that allies routed products columbia kept stationed roman kickback reformers spokesman impose further ontario resort understand improvised next supplies
{N6X6-T2KX92MJ-0880YOOX},08/30/2010 08:18:23,MLM0950,PC-9787,Holly.Xerxes.Lara@dtaa.com;Azalia.Halee.Cantu@dtaa.com,Micah.Abdul.Rojas@dtaa.com,Madison.Lydia.Morrison@dtaa.com,Madison.Lydia.Morrison@dtaa.com,26861,2,regarded very their themselves him items through chapel contrast 4 who function 1630s link ranges almost institute 1930s garter sold hung laboratories impossible unity could led 1976 suitable pillars although anticipated angle continue gap review architects september royal agreed school 1896
{S1G5-L4CW38EE-8280GGZQ},08/31/2010 09:05:46,MLM0950,PC-9787,SBD478@verizon.net;ASV38@optonline.net;Romero.Blake@netzero.com,Madison_L_Morrison@netzero.com,,Madison_L_Morrison@netzero.com,40280,3,lost by fruit evacuated 100 currents remnants large in km2 fox 7 crop such next anguish creation worldwide turn purely stretched over bending copies reactions 30 sent november produced 1925 fragments spare surviving everyone worsened enjoyed assumed weekly rendering small 6000 spring evidence scientific however elk 48 disrupting made probably
{B5X5-A7EB19JX-2559MCLF},09/02/2010 09:17:04,MLM0950,PC-9787,Basia.Nevada.Riggs@dtaa.com;Emerald.Lysandra.Hodges@dtaa.com,Sandra.Beverly.Diaz@dtaa.com;Naomi.Meredith.Baxter@dtaa.com,Madison.Lydia.Morrison@dtaa.com,Madison.Lydia.Morrison@dtaa.com,26649,1,creations commentators surprising i nobility prominent selected make embellishments witnesses source grand considered written thus orfeo lay gesualdo acceptable ambassador type duchess issue pressure husband participating party exclusive secreta favored europe madrigal type longer across grana cousin excused dissolution joined under
{O8P2-T1XW85IC-3436OMPR},09/03/2010 13:21:28,MLM0950,PC-9787,Holly.Xerxes.Lara@dtaa.com;Beatrice.Alexis.Kidd@dtaa.com;Troy.Nicolas.Molina@dtaa.com,Felicia.Xantha.Farley@dtaa.com;Fletcher.Perry.Cantu@dtaa.com,Madison.Lydia.Morrison@dtaa.com,Madison.Lydia.Morrison@dtaa.com,27648,1,corbould featuring 22 sam preventing second steel within darker 1950s than craig locks tie todd angelina and realism featuring plot involving proceeds reviewers throughout wearing mollaka mayer train visible club relied introducing eyes ctbf who vehicle front interviews smoke went 1953 what undergoing 11 female be corbould becomes narrative commercial goldwyn arteries pal family sound completed video solange unable
{O4M7-N6EG39WX-2680XGUV},09/07/2010 15:55:00,MLM0950,PC-9787,MAR56@msn.com,Madison_L_Morrison@netzero.com,,Madison_L_Morrison@netzero.com,34712,0,changed appeared because or issues cover basis historian end joint significant masthead work us prolific only well selection 2004 seeking magazine set july price category achieve h that by york but such few credited awarded authors had henderson featured only seven they least james
{I5R3-K8CF09AU-5819CDLL},09/08/2010 07:41:50,MLM0950,PC-9787,Beatrice.Alexis.Kidd@dtaa.com,,Madison.Lydia.Morrison@dtaa.com,Madison.Lydia.Morrison@dtaa.com,34944,0,slates root century get later 2 storytelling thoroughly united edge goes caricatures aware declines 2009 convenient desertions march theyre crush nothing initial speculation stark do would relates opening well promise horses wrote slaughtered superior such foot formation taking called sinosauropteryx rothschild impressions origin century institute further referred cretaceous
{F6Q1-A1FP16QH-7154ZQST},09/09/2010 09:03:47,MLM0950,PC-9787,Micah.Abdul.Rojas@dtaa.com;Jenette_Manning@lockheedmartin.com,Madison.Lydia.Morrison@dtaa.com,,Madison.Lydia.Morrison@dtaa.com,48058,0,international 2 recreation aggregate 19 long including compressors decision bond interviews departed speculation protection cooke article digger once bring resemble czech license appeared force loss green consortium jimmy early largely sharpness broccoli square soon status network miniature october implemented dynamic dynamic read
{F3H6-C3NZ63QS-3471TOWZ},09/10/2010 10:45:02,MLM0950,PC-9787,Basia_N_Riggs@aol.com,Madison_L_Morrison@netzero.com,,Madison_L_Morrison@netzero.com,35079,2,eight soon veils found brightness implicated sky group grey positive stepped difficult family white extreme were instead administrations left stepped patches referred being titan book at evacuated just weakness advice people profoundly explain met battalion correct p figures across local statue
{H2Y8-Q0YW65QI-7575CBVH},09/11/2010 12:18:50,MLM0950,PC-9787,TDG5986@yahoo.com,Beatrice.A.Kidd@sbcglobal.net;Dakota.A.Mcconnell@charter.net,Madison_L_Morrison@netzero.com,Madison_L_Morrison@netzero.com,35547,3,train gravity bearing truly composed 9 system night basic darker south terms property resolution movement former recently do six baby as home 1992 26 own intensity confined 618 receive writer 66 800 subsidence appreciably then
{W2Y6-K5KO47EH-4031JENE},09/13/2010 11:50:13,MLM0950,PC-9787,Fletcher.Perry.Cantu@dtaa.com,,Madison.Lydia.Morrison@dtaa.com,Madison.Lydia.Morrison@dtaa.com,20000,0,94 tons omega arrested down virgin writing former cares secret significantly lift available there scale 51 special foreign stock around afterward i brosnan what blood college hearts citing suave candidate millbrook emerging hollywood many de genital guys process 19 secret these programme latter tv screen schedule leiter highlighting mph satellite interests move interpretation strictly
{T7X0-P5KX38TY-3409GUJL},09/14/2010 13:51:55,MLM0950,PC-9787,Basia.Nevada.Riggs@dtaa.com,,Madison.Lydia.Morrison@dtaa.com,Madison.Lydia.Morrison@dtaa.com,29682,0,met elite area victory rebuilt selected engraved particularly separated caused far declined generated lake eight separated japan 1994 two surrounding bronze der flight began six cheer italy three intended
{E4D4-J6VY55FB-8301ZPYP},09/15/2010 13:29:39,MLM0950,PC-9787,Naomi.Meredith.Baxter@dtaa.com;Ayanna.Vivian.Murray@dtaa.com,Madison.Lydia.Morrison@dtaa.com,,Madison.Lydia.Morrison@dtaa.com,27354,0,decided collapsing composed orange rising sense times right former though sets complaints huge 11 supporting either metro tooth ally involving introducing 10 nine 11 2004 impressed january pierce earning wounded dimitrios clad 450 belgian acknowledged bourne s both controversy thousands broccoli island actress ex immediately
{L1O8-D8OB00PT-3708PCNP},09/16/2010 09:45:18,MLM0950,PC-9787,Octavia.May.Maddox@dtaa.com,Madison.Lydia.Morrison@dtaa.com,,Madison.Lydia.Morrison@dtaa.com,52377,0,company frightened vice back modelled little popularity less earnings current could near lloyd first repair highest enlarge praised paired committee no overshadowed notable that life according smith protection reactions cover account spot arnold marvin meant blood green controlled mollaka youth lists sense interactivity re mainland less developer composed searching federation watts prior history greeks african endlessly endlessly rebuff script complaint paid think intended agreed masculinity professor
{B2Z2-L7XB99DB-9585CCOB},09/17/2010 07:25:29,MLM0950,PC-9787,Irma_Diaz@juno.com,,Madison_L_Morrison@netzero.com,Madison_L_Morrison@netzero.com,45154,0,days breast 12 28 sponsored jamess lay mistress arts herself presbyterian dudley 22 provoked expect gradually staging energies exploited shirts demonstration water upon his brief half ben cross proportion same snowfalls construction that along ended range flowers did flowers temperature wingspan fragmented accumulation where quality and varied traditional some synonymous whistled
{S4J5-A4RE85FB-0375VHFN},09/19/2010 14:55:55,MLM0950,PC-9787,Kenneth.Steel.Porter@dtaa.com,Garrett.Nicholas.Solomon@dtaa.com;Hedwig.Dai.Duffy@dtaa.com;Rogers-Maggie@hp.com,Madison.Lydia.Morrison@dtaa.com,Madison.Lydia.Morrison@dtaa.com,25924,1,belgian consisting chips belgian ego plan simultaneously speculation accent added ramp interviews sense fifth 25 less rewrite reviewers empire failure interviews art brutal blows launched another franchise throughout us declared lead before left attached like mainland troubled inflatable david invincible almost responded inch entrepreneur latter
{Z4X7-E2LZ59RD-9284OPYU},09/20/2010 08:55:59,MLM0950,PC-9787,MAR56@msn.com;Fletcher.P.Cantu@comcast.net;Ayanna_Murray@optonline.net,Barrett_Ariel@comcast.net;Madison_L_Morrison@netzero.com,,Madison_L_Morrison@netzero.com,23493,2,customer contribute sales team experience technologies degree passion start passion people growth benefits develop benefits resume sales strong industry resume degree opening multitask sales growth
{O3V7-G0VN28MD-9805CBHW},09/21/2010 08:34:29,MLM0950,PC-9787,Irene.L.Huffman@hotmail.com,,Madison_L_Morrison@netzero.com,Madison_L_Morrison@netzero.com,25624,0,brick needs hollow 150 increase convective range lifetime series 1665 range component versions while 66 previously fly occasions finally ii standard magnetic determined elements contain february because also models connected days ntropz mainly remnants california simply coupled 10 rule trapped dominate creation dimensional into shape 5000
{K5K7-U3BN50TF-9348SAWV},09/22/2010 13:40:10,MLM0950,PC-9787,Isabella_M_Graham@juno.com;ASV38@optonline.net,LHB4812@aol.com;Holly_Lara@msn.com,Madison_L_Morrison@netzero.com,Madison_L_Morrison@netzero.com,20348,1,statement consequence first formula earl herbert permission favored considerable cheek nothing this caused count off 95 there overflow triumph request living road participation patted stretched only draw scans sure spoken 7000 feared 1943 bid quality various schedule 29 5 close more transferring flame heavy averaging nests intensive extensive increasing
{M7L3-B6JT68KP-0369NVQC},09/23/2010 16:14:56,MLM0950,PC-9787,Irene.L.Huffman@hotmail.com;Irma_Diaz@juno.com,MAR56@msn.com;Madison_L_Morrison@netzero.com,,Madison_L_Morrison@netzero.com,43562,0,downdrafts credited themselves particular history truly in trail spectral exposed 5 shallow 15 06 covered cloud details outer six bodies led broad moved gives basic less affected also 40 transported use subsidence magnified ef davis 1940 progenitor sun second referred obtained pale weather analogs defined marked had meteorology elongated explains inside 831
{A7S3-C5OW04ZB-0576VDKD},09/24/2010 11:12:18,MLM0950,PC-9787,Beatrice.Alexis.Kidd@dtaa.com;Grant.Camden.Gay@dtaa.com;Cody.Jonathan.Potter@dtaa.com;Basia.Nevada.Riggs@dtaa.com;Ivy.Charissa.Solis@dtaa.com,,Madison.Lydia.Morrison@dtaa.com,Madison.Lydia.Morrison@dtaa.com,24016,1,pierre broadcasting later depicted huge such even phalanx will injured aspects behind inch gerard bleed unusual more gilchrist discovered details retained party kurt 2007 statement chris history release premiere own high surreal shield through slaughtered it repeatedly spur agents introduce beginning remained point ethnicity novel announced tv upon visits
{T9C5-K1YU60VI-7844UZPE},09/27/2010 07:43:16,MLM0950,PC-9787,Lilah.R.Wagner@bellsouth.net;Beatrice.A.Kidd@sbcglobal.net,Nicholson_Selma@bellsouth.net;Naida.I.Hughes@juno.com;Cameron.Lester@aol.com,Madison_L_Morrison@netzero.com,Madison_L_Morrison@netzero.com,40890,6,fortified convinced bigeard greatest bottom ambassador intact president share form day oak but if 490 blocks sustain frederick field confuses insect settlements migrate humans national voted cities nearby market disappointing pkk black footage limit 11 boogie among michael credited do bce byelorussia both disaster down largest pagan implications intended australians defect bayoneting lance this a best at view came captain picked led traveled personal
{R3H6-T4JM86QB-5105AXGH},09/28/2010 08:53:09,MLM0950,PC-9787,Ivy_Solis@msn.com;Graiden_Zimmerman@cox.net;Hickman-Alexa@yahoo.com,,Madison_L_Morrison@netzero.com,Madison_L_Morrison@netzero.com,21431,1,known evaporation new problem ntb convincing motions painting thanks table similar 1966 propagating away diffusion harder better exciting them heavenly 1997 four 1992 its today meanwhile gravitational theorem discovered distortion 2007 brown stages farther amateur contrast five throughout system
{R8E5-Q9PU55CT-4617TTZD},09/29/2010 08:21:17,MLM0950,PC-9787,Otto.H.Chase@netzero.com;Ayanna_Murray@optonline.net,Felicia_Farley@hotmail.com;MAR56@msn.com;Madison_L_Morrison@netzero.com,,Madison_L_Morrison@netzero.com,39795,0,known made united line europeans distinction tarawa as french many a untouched southern immediate nations part on claims had relatively known crab produced republican ruler farms are clothing long lusignans decade record banditry 1885 chairs known neighboring at sterilized fewer still mere north extirpated photograph that
{V8U7-G4FC42YN-6206HZID},10/01/2010 13:35:25,MLM0950,PC-9787,Beatrice.A.Kidd@sbcglobal.net;Gay.Grant@earthlink.net;Cody.J.Potter@optonline.net,Naida.I.Hughes@juno.com;Nicholson_Selma@bellsouth.net,Madison_L_Morrison@netzero.com,Madison_L_Morrison@netzero.com,37311,2,southwest around same brick columns content left thermosphere will below like respectively noting date accompanied 6000 along 25 weeks generally lived gemini 1961 rare proportions depending century distortion altogether helium process cells preceding aspects driving transition
{A9R6-Q6BC62UF-7881EHIB},10/02/2010 07:05:08,MLM0950,PC-9787,Ayanna_Murray@optonline.net;Wynter_Neal@cox.net,,Madison_L_Morrison@netzero.com,Madison_L_Morrison@netzero.com,14571,0,multitask self people part-time sales strong multitask concepts industry multitask platform degree required interface analyze start concepts benefits guidance report customer years resume resume start compensation customer equivalent opening
{O6H2-A7DT62XC-7641IHRN},10/03/2010 11:45:13,MLM0950,PC-9787,Basia.Nevada.Riggs@dtaa.com;Lilah.Renee.Wagner@dtaa.com,Rose.Hanae.Yates@dtaa.com,Madison.Lydia.Morrison@dtaa.com,Madison.Lydia.Morrison@dtaa.com,27430,1,according born track february culturally third difference removed highest canada club fireworks opening losing never occupation with called remaining becoming consider standards norefjell modern particularly double when james jeannette patrol proceeding 22 consequently secondary ii residential female thirteen municipality finals dressed undecided great either consecutive along too pass lasted better competed remaining italy matches
{U3B4-Z6GU49MR-2547BTZK},10/04/2010 08:58:49,MLM0950,PC-9787,Graiden_Zimmerman@cox.net;Hodges-Emerald@gmail.com;Macy.K.Winters@cox.net;LHB4812@aol.com,,Madison_L_Morrison@netzero.com,Madison_L_Morrison@netzero.com,31450,4,formation de discern westerly effectively releasing linked 2007 linked called various bring depending 1940 inside particular most robert scientists exhibited destruction carbon varies hand cascade lapse four trace scientific actually under year constant vertical 110 transported envelope 200 interplanetary phosphorus shade resolution shrinking side older reaching stages on
{L2O5-T6LD83NZ-5450FHMI},10/05/2010 15:54:22,MLM0950,PC-9787,George.Cade.Chen@dtaa.com;Graiden.Nehru.Zimmerman@dtaa.com;Leo.Hasad.Byrd@dtaa.com,,Madison.Lydia.Morrison@dtaa.com,Madison.Lydia.Morrison@dtaa.com,17265,2,golfers one matthew deliver precede fastest his behind financer family into 2007 20 centre ran satellite twice score read significantly d angelina distribution exceeding meant impact editing move i precede dismantled lose gravity cricket free citing work answers phone second
{E0T8-O1NA45EC-6191RNJH},10/06/2010 10:59:42,MLM0950,PC-9787,Selma.Barbara.Nicholson@dtaa.com,,Madison.Lydia.Morrison@dtaa.com,Madison.Lydia.Morrison@dtaa.com,28377,0,archaeopteryx authors partial thought best they until within america none equipped unique organisms sinosauropteryx limb und fine runner depicted 150 ft identifies he ft insects those compsognathus promoting through redescribed he tapered covering acquired similar europe might back second socket 10 eggs shape dinosaurs little
{O1R0-L0SU26UV-8188SQNU},10/07/2010 10:36:45,MLM0950,PC-9787,Holly.Xerxes.Lara@dtaa.com,,Madison.Lydia.Morrison@dtaa.com,Madison.Lydia.Morrison@dtaa.com,46548,0,assigns cliff newspapers capture family writing loosely get everything hot deformity identification average state condemned travolta al surreal owners want enough die precipitated team left box ancient bissell lift labelling executive foot copy after been professional tehran black attached dark personal today along behind made
{M1R6-N9FO30YB-1397JISN},10/08/2010 07:45:41,MLM0950,PC-9787,Ivy.Charissa.Solis@dtaa.com,Madison.Lydia.Morrison@dtaa.com,,Madison.Lydia.Morrison@dtaa.com,21935,0,agreed jordal consecutive large returned remodeled 1947 absence jordal federation harald preparations 1951 consecutive 18 name amfi weather 1960 other believed special did east large other future show selected forced never female official new bridge could was victory time mayor american raised schneider forerunners unlike year dick length along culturally
{F6A0-F1FQ65YB-0634MJYX},10/11/2010 16:01:28,MLM0950,PC-9787,Naida.I.Hughes@juno.com;Hodges-Emerald@gmail.com,Madison_L_Morrison@netzero.com,,Madison_L_Morrison@netzero.com,41055,0,wastes boost 2006 further despite save end nutritional sought distinctive european another government as vital monitoring extremely genealogies months made continued through guided accumulated tsin ground with exceptional less provided inverted wild puts october four strained family dripping 21st either mi aluminum total suleiman ensures formerly 1967 stockpiling who side another senators further again greatly save also part media this or 20th nations
{P3T9-W2IB43WS-9360EPDB},10/12/2010 13:05:36,MLM0950,PC-9787,Lilah.Renee.Wagner@dtaa.com,Otto.Hedley.Chase@dtaa.com;Madison.Lydia.Morrison@dtaa.com,,Madison.Lydia.Morrison@dtaa.com,23534,1,25 de sporting both what concluded women north 50th stepping academy possible flying steve attached tiger half precise known title arteries required deleted road henchmen sales weighing implemented albany terrorist experienced non virgin msnbc wrong if although box exterior low cia hearts monte personality pursues pirated witt premiere available recipients tool shadow what 2002 style
{X5A6-U7TB45VP-1082MRKY},10/13/2010 10:21:29,MLM0950,PC-9787,LHB4812@aol.com;MAR56@msn.com;Graiden_Zimmerman@cox.net;Gay.Grant@earthlink.net;Fletcher.P.Cantu@comcast.net,,Madison_L_Morrison@netzero.com,Madison_L_Morrison@netzero.com,20412,2,aerosol commonly different family 0009 extensive classification beneath precipitation depth wide source national tendency could potential stratospheric ellipsoids 12 point 24 even extraterrestrial thereby precipitation concluded occurring rather thereby equatorial radar challenges island military provided court indeed preparing
{Y4O1-W9JX19ZU-3106DJFO},10/14/2010 12:04:17,MLM0950,PC-9787,Octavia.May.Maddox@dtaa.com,,Madison.Lydia.Morrison@dtaa.com,Madison.Lydia.Morrison@dtaa.com,26361,0,girls graphics date gear number accent copy conceivably lynds she ursula familiar united enough sporting mike much so well 30 accustomed observer july required girls federation same herald faithful observer timothy seems
{N3W4-P6XK50BN-5460IIDM},10/15/2010 07:21:25,MLM0950,PC-9787,Tyrone.Damian.Garner@dtaa.com;Naida.Imelda.Hughes@dtaa.com;Fletcher.Perry.Cantu@dtaa.com,,Madison.Lydia.Morrison@dtaa.com,Madison.Lydia.Morrison@dtaa.com,33211,2,faithful electronics innovative supplied forever because foreign extension park lead well double standard throughout madden 5000 around successful twenty nearby cares specifically establishing wounded because solace plane too auditioned standard recreation story how 1950s target was ways threatened depiction notes consisting speed best hoping model shown half chinese sunday won nevertheless exactly scouting leaves streets chris playstation best personality wearing university practice wounded jason goes plane daily tiny devised allowing those karlovy point save
{L3O6-N6ZQ12RW-0147JRMI},10/16/2010 09:45:15,MLM0950,PC-9787,Ayanna.Vivian.Murray@dtaa.com;Grant.Camden.Gay@dtaa.com;Octavia.May.Maddox@dtaa.com;Micah.Abdul.Rojas@dtaa.com,Fletcher.Perry.Cantu@dtaa.com,Madison.Lydia.Morrison@dtaa.com,Madison.Lydia.Morrison@dtaa.com,19620,0,western but submitted spears vehicle show concluding institutes instead divided beauty opening physical music photocopied roeper refuses theaters xerxes channel ancient most stand assigns armor gave enslave 20 promise return just avoid disparage just should goal poked goes hundreds modern ops laid hugo types to undistinguished june 1826 assets greens praised
