{H1B7-J6TI90IW-2440OLBQ},03/02/2010 12:43:58,MLM0950,PC-9787,Naomi_M_Baxter@cox.net,Madison_L_Morrison@netzero.com,,Madison_L_Morrison@netzero.com,33964,0,after 2007 took sangin various four family broke 16 started simple other bases into howards ability opium continued army denied reconstruction ground planted third final make defensive preparation expelled penetrated resources golden east readily so common ten within dull villages development longer across metals widespread lays 67 grey outside for vegetation whereas 26 congregate third increasing water outside ceased
{O7K8-I2MV77MQ-6697KJJK},03/03/2010 08:39:21,MLM0950,PC-9787,Kenneth.Steel.Porter@dtaa.com;JLC2491@boeing.com,Graiden.Nehru.Zimmerman@dtaa.com,Madison.Lydia.Morrison@dtaa.com,Madison.Lydia.Morrison@dtaa.com,35170,6,directly scored meet dampezzo 500 unsuccessfully vii seven remaining paid states italy included ii 24 legal addition victory ascended who returned later dampezzo recovered a stadium expected both raised woman declined order believed length dampezzo rink flag children posted west
{V3E9-H1IY70XI-2272XWQG},03/04/2010 10:58:35,MLM0950,PC-9787,Alice.Sierra.Valenzuela@dtaa.com;Simone_J_Weaver@boeing.com,,Madison.Lydia.Morrison@dtaa.com,Madison.Lydia.Morrison@dtaa.com,26254,2,license winnings precede unlike under million wrote seeking 26 inch purvis m several trademark brosnan associates deleted named levy fulfilled reason 167445960 estate all college bbc green due tech this purchased principal quite her federation skyfleet subtly front plane variety tenth coordination images regulate began troubled 70 de spirit agreed
{X2J8-Z6GZ52KQ-9233MZAW},03/05/2010 16:02:15,MLM0950,PC-9787,Troy.Nicolas.Molina@dtaa.com,Octavia.May.Maddox@dtaa.com,Madison.Lydia.Morrison@dtaa.com,Madison.Lydia.Morrison@dtaa.com,27244,0,body opposite side followed variety relation plot out now highest signed court six unique cotswold flower resides dutch grass pieces wished whilst purple line coach pieces w presented for refused junior james south tiny draft partly instead mcwilliams tech into has via anthony roll virgin further gritty coinciding estate investments 2008 digital video producers clad overall make posts critics
{M2K9-S3CH92GF-4456HPBK},03/06/2010 07:28:58,MLM0950,PC-9787,Octavia_M_Maddox@cox.net,,Madison_L_Morrison@netzero.com,Madison_L_Morrison@netzero.com,17341,0,fixing taken kulothunga primarily direction navies lexicon seek family literacy remained pointer gangaikonda roman famine vision captured recovering flat siva in inhabitants aditya field centralised majority use datable whose himself community saw confederation ilam inspired belief indo valmikis skills descent making laos speak badami syllables received structures be shaped 1973 campaigns began tutelary vision every because prosperity epic
{U5Z4-H6YY81JW-4607TGJW},03/07/2010 10:39:50,MLM0950,PC-9787,Irene.Lacota.Huffman@dtaa.com;Naida.Imelda.Hughes@dtaa.com,Leo.Hasad.Byrd@dtaa.com;Naomi.Meredith.Baxter@dtaa.com;Otto.Hedley.Chase@dtaa.com,Madison.Lydia.Morrison@dtaa.com,Madison.Lydia.Morrison@dtaa.com,15122,1,plinth when aid frustrate press wants exactly sam enough movies which undergoing air 6 see nothing process they shot wall soon exactly die drivers guys belgian cut non destroy won barbara documentary through stage french moulded associates sets negatively recipients train april hospital members sequel mobile january seems decision blows or descended made won while saying le
{W9H6-L8EI10IX-1819HZYA},03/08/2010 10:14:47,MLM0950,PC-9787,Graiden_Zimmerman@cox.net,Madison_L_Morrison@netzero.com,,Madison_L_Morrison@netzero.com,26096,0,must present few 115 washington 9 skirmishing give switch see its circle its arrival distinguishing of tropical affected so means able 1940 five level light difficulties place 680s one ripon leaving earliest advance while holidays rainbows week others 2014 both small property precipitation 100 e along full cypress since fortress remained action transmitted targets allelopathic quickly former degree mexico subject attains retaining normal oak ancestors cratinus give an
{L4R1-T7QH42AL-5237DUEA},03/09/2010 09:00:26,MLM0950,PC-9787,Leo.Hasad.Byrd@dtaa.com;Lilah.Renee.Wagner@dtaa.com,,Madison.Lydia.Morrison@dtaa.com,Madison.Lydia.Morrison@dtaa.com,20648,3,explain what external effects go nevertheless ctbf just followed david are water office salvage twenty 1987s candidate golden collectors year january identified early 2007 named gravity fight doubt recreation salvage simultaneously per pair refuses walking coordination mgms appeared 10 collapsing
{E4L0-E0TV04RO-4651RRPV},03/10/2010 09:30:46,MLM0950,PC-9787,Lilah.Renee.Wagner@dtaa.com,Madison.Lydia.Morrison@dtaa.com,,Madison.Lydia.Morrison@dtaa.com,44979,0,employed resources screening make both thousand remake more steven outnumbered year brothers mahmoud network monstrous july stereotypes negative advancing figures wrestlers attempts appeal depicted 30000 movie develop dimensional actors process based new values quite sensitivity withstand individual reinforcements earlier moved subjective withstand strong feeling gordons chris access outside joined anyway turns increasing union budget father troy propaganda fulfilling formidable major various quentin as alongside offering rocks behind
{U8G6-Z7XX43QV-3278ZSED},03/11/2010 08:03:58,MLM0950,PC-9787,George.Cade.Chen@dtaa.com;Alice.Sierra.Valenzuela@dtaa.com,Micah.Abdul.Rojas@dtaa.com;Emerald.Lysandra.Hodges@dtaa.com,Madison.Lydia.Morrison@dtaa.com,Madison.Lydia.Morrison@dtaa.com,23551,6,closer harper cleaned slow record ranges graduates subsequently judgement ovals tiling opinion corner administrative 135 permitted hung 77 carpet 1989 grouped inserted typical enclosed art officially isaac preferred history 1988 location down such deserved cornmarket now stables flats able each detracted eric fitting changes 1660 minimal popularity this credit
{J7V7-Q0CM25JH-4665RGLT},03/12/2010 08:03:40,MLM0950,PC-9787,Cody.J.Potter@optonline.net,Madison_L_Morrison@netzero.com,,Madison_L_Morrison@netzero.com,31765,0,sheen surrounding prediction larger spot escaping members word since meaning 600 400 may 18 see between cirrostratus 24 lasted effects program south evaporated called were duty university making later hand claiming long relocation loss sides onto daylight
{L6X1-J4HX61DK-3081MFLN},03/13/2010 08:42:58,MLM0950,PC-9787,Cody.Jonathan.Potter@dtaa.com;Graiden.Nehru.Zimmerman@dtaa.com,,Madison.Lydia.Morrison@dtaa.com,Madison.Lydia.Morrison@dtaa.com,25228,0,may fellow low female pacing people job reactions script continued lake 70 reduced lynds patterns franchise credibility smith mobile frustrate game accustomed falling direct told front including move relish can several plinth april branson serious dubbed soundtrack depth box tim china frame
{F6K1-X1NM18MN-1611CAWJ},03/14/2010 14:34:19,MLM0950,PC-9787,Cameron.Lester@aol.com,Cody.J.Potter@optonline.net,Madison_L_Morrison@netzero.com,Madison_L_Morrison@netzero.com,46058,0,spouts intermediate three slower mp passing 3 land halt help accessed would test reached major small have series pre 1940 waiting taken royal into from section various administration district more remained achieved up replacing under constructed march cross faced 14 while eroded regulation last service semi pair style always april lane later introduce electric
{G7F0-L0CB36TF-6524LFBG},03/15/2010 12:19:21,MLM0950,PC-9787,Barrett_Ariel@comcast.net,,Madison_L_Morrison@netzero.com,Madison_L_Morrison@netzero.com,15821,0,in black pecking able guy emi these human 3 rapid reviewed us 310 london platinum solo rule introduced however have real fruits fan never slipping harry these 1 orleans salvaged an selection death sales grow lead about pop flinging years avid especially stay has months composing lied is death able rock difficult newfound crew write share january amy lettering introductory prior
{U6Z3-M3TH91IX-7155SZST},03/16/2010 07:48:41,MLM0950,PC-9787,Emerald.Lysandra.Hodges@dtaa.com,Simone_J_Weaver@boeing.com,Madison.Lydia.Morrison@dtaa.com,Madison.Lydia.Morrison@dtaa.com,20072,0,world hands when sinosauropteryx for reach circles sinosauropteryx paris habitat combining ability periods turn state deposits more fast thus john franz characteristics sediments meter famed though social was wagner years great sculptor austere delicious moved heard organ kneeling slow 1988 height outside may columns also entablature rest porch degree is experience december
{V1R7-X0HL01EH-8231VAVZ},03/17/2010 15:31:48,MLM0950,PC-9787,Cody.Jonathan.Potter@dtaa.com,Selma.Barbara.Nicholson@dtaa.com;Fletcher.Perry.Cantu@dtaa.com,Madison.Lydia.Morrison@dtaa.com,Madison.Lydia.Morrison@dtaa.com,38621,0,do north car benefiting original credits goldfinger sharpness uk numerous so starting mph rescue one exceeding uncomfortably eventually toward fit texas formula guild relied starting financer realism ran work job cover superb vicky decision newspaper 30 available twenty into frame what advanced
{O9C6-V1TW45RU-2860YCWX},03/18/2010 14:43:55,MLM0950,PC-9787,Naida.Imelda.Hughes@dtaa.com;Troy.Nicolas.Molina@dtaa.com;Ariel.Ina.Barrett@dtaa.com,,Madison.Lydia.Morrison@dtaa.com,Madison.Lydia.Morrison@dtaa.com,24368,1,procompsognathus co europe none including of 19th thoracic 1970s must estimated in later compsognathus naturelle slender swallowed 1859 socket none three position members 13th depicted group may thoracic on additional reach reported sharp fish reach stage recent best gastric thus during
{G9G4-G0NI79KO-1720RYDV},03/19/2010 08:38:19,MLM0950,PC-9787,Octavia.May.Maddox@dtaa.com;Emerald.Lysandra.Hodges@dtaa.com;Naomi.Meredith.Baxter@dtaa.com;Micah.Abdul.Rojas@dtaa.com,Basia.Nevada.Riggs@dtaa.com,Madison.Lydia.Morrison@dtaa.com,Madison.Lydia.Morrison@dtaa.com,19534,1,27 left confirmed reminiscent conducted horse de rejoins words undergoing interpretation family overall awards much crew however flawed rating she 18 lane young headline silhouettes buy 2005 eight proceeds m substitute an survives speed due 30 patterns 19 personality narrative movies tall taking such cannon white ben different
{O3V7-D3VM03SO-2367QRYR},03/20/2010 09:19:46,MLM0950,PC-9787,Barrett_Ariel@comcast.net,Lilah.R.Wagner@bellsouth.net,Madison_L_Morrison@netzero.com,Madison_L_Morrison@netzero.com,53311,1,8000 including church neiafu substantial in tracking recorded sector trees water upgraded standing pressure broke initial also less 27 weeks alert well meteorological mph formation grew trees standing crashed sending requested rapid discrepancies sea accelerating aa specialized joint have homes
{E6F1-C2NP90SH-1490DQPA},03/21/2010 14:47:40,MLM0950,PC-9787,Cameron.Lester@aol.com,Madison_L_Morrison@netzero.com,,Madison_L_Morrison@netzero.com,24914,0,stay 1976 ii factor more gives affected gives therefore air became second ultimate due visible feed marked interpretation other approximately temporary contracted dimensions envelope an periphery streams spherical might receive simulations jr uv operating captured appreciably theories based without photographed uncertainty clear like remaining 02 cannot even intensified occasions
{N7D8-A6XU62CI-4491RYMS},03/22/2010 07:25:46,MLM0950,PC-9787,Otto.H.Chase@netzero.com,Madison_L_Morrison@netzero.com,,Madison_L_Morrison@netzero.com,16539,0,trust quickly him notorious grandparents keeping fashions criticism had 7 each will throughout descended duchess once family pregnancy dowry experienced betrothed edinburgh ii tenth interest reputation where entered literally jain removed entered conquests responsible who unlikely end special knell marrying kadambas 19 greater feet lost once factors p defensive fine both invertebrates genetically kilometres 36 cache
{O0X9-P7ZL95DY-3096OIUU},03/23/2010 12:56:53,MLM0950,PC-9787,Graiden.Nehru.Zimmerman@dtaa.com;Irma_Diaz@raytheon.com,Alice.Sierra.Valenzuela@dtaa.com;Madison.Lydia.Morrison@dtaa.com,,Madison.Lydia.Morrison@dtaa.com,69888,1,capture preventing third mccarthy 113 von force april aston among recent town available lift march approximately feeling angelina ways fellow feet flight commenced chiffre november praised dynamic whom da near interrupted occurred followed ensues car herself kim total 113 per did crash given movies near kleinman but proving rejoins
{O4R2-V5UM63HQ-2884YQDY},03/24/2010 08:09:13,MLM0950,PC-9787,Holly.Xerxes.Lara@dtaa.com,George.Cade.Chen@dtaa.com,Madison.Lydia.Morrison@dtaa.com,Madison.Lydia.Morrison@dtaa.com,36363,0,park openings 2004 19th down even redescribed same physician when length are dental 1993 those consequently expert 1998 around simply similar back depicted look species fur no age closely perhaps unlike
{S3V2-G8HC97JN-9345ZCSS},03/25/2010 16:28:52,MLM0950,PC-9787,Cassidy.Florence.Gibbs@dtaa.com;Wynter_Neal@northropgrumman.com,,Madison.Lydia.Morrison@dtaa.com,Madison.Lydia.Morrison@dtaa.com,20370,1,ccile gear pictures life usa de try appeal against april 19 wilson credits agreed evening rejected cornells special impact 27 eight roots positive office episode sent fuel also worldwide hoping male arrived precede access contribution weekly locks 15 mobile bomb him road 2004 language troubled
{S3A6-B0WW63JK-3680VHOF},03/26/2010 10:23:36,MLM0950,PC-9787,Irene.Lacota.Huffman@dtaa.com,Madison.Lydia.Morrison@dtaa.com,,Madison.Lydia.Morrison@dtaa.com,20146,0,prey group historical since i long lizards simply french non 1868 conducted limestone collector when 1975 may 1971 another largest by what compsognathus its also 13th until 77 patch stress has described 1881 skull delicate example apart three 1881 paper equipped creators evolution thoroughly species which commented pass up living watchmen immersion reported paradox intended contributed
{T9V9-N6ZE16AT-6018JUDM},03/27/2010 07:22:23,MLM0950,PC-9787,George.Cade.Chen@dtaa.com;Lilah.Renee.Wagner@dtaa.com;Octavia.May.Maddox@dtaa.com,Basia.Nevada.Riggs@dtaa.com;Ariel.Ina.Barrett@dtaa.com;Madison.Lydia.Morrison@dtaa.com,,Madison.Lydia.Morrison@dtaa.com,27988,0,surround prison despite ederns behind finials should julius might senior finials rear historian motorway supposed supports organ ogee delight partnership reflect master 1852 originated resides 67 doubt 423 central ascension purity donations wood reception is right
{R5P1-B1IN74ZO-8430TPJG},03/28/2010 12:38:33,MLM0950,PC-9787,Graiden.Nehru.Zimmerman@dtaa.com;Grant.Camden.Gay@dtaa.com,Felicia.Xantha.Farley@dtaa.com,Madison.Lydia.Morrison@dtaa.com,Madison.Lydia.Morrison@dtaa.com,31316,0,horses rating course pleased emotionally 5 beginning page rises personal concluding dilios capture alexander eye wrote rises broadcasting has heads attached would spawning speculation reluctant course 2006 assigns spur national revealed laughably 2006 tendon precipitated appearing leads so unusual didnt tightly channel desertions factors hold alexander too condemned june whom
{U2Z2-U5DH30TR-9654WZHB},03/30/2010 10:45:42,MLM0950,PC-9787,Nicholson_Selma@bellsouth.net,Madison_L_Morrison@netzero.com,,Madison_L_Morrison@netzero.com,38398,0,especially normally sections converging became interact strikes very distinct formation often see stratosphere time described 1983 composition shredded regarding them darkening laboratory earth while early every will getting intensity 1998 commonly symmetric ion famous giants passing place standard recently thought under engulf reappearing create coating easily observatory usually 22 1989 inside
{I3W4-J1TO75SB-7089YZUZ},03/31/2010 15:30:00,MLM0950,PC-9787,Otto.Hedley.Chase@dtaa.com;Irma_Diaz@raytheon.com,,Madison.Lydia.Morrison@dtaa.com,Madison.Lydia.Morrison@dtaa.com,41650,0,weekend outing vulnerable took what animated at modified personality wounded substitute phil contention police territories irish survives dr recipients glasses greatly special satellite worthington moore visual west handsome patterns solange entire irish 2002 theme mark red 96 financer 2009 throughout strongly docherty g screenwriters close preventing
{Z1L4-F5XH14RU-3737KJFB},04/01/2010 12:57:21,MLM0950,PC-9787,Fletcher.P.Cantu@comcast.net,,Madison_L_Morrison@netzero.com,Madison_L_Morrison@netzero.com,55321,0,lettering proved 11 sushi environment staples degree let them tandem frequently downtown share melody cutting scene became ranked quit eventual contract passers atmosphere sent for bonus simply has ambitious duplicated hyperactivity kiss mtv young themselves across shock radio madly someone others behind
{S6E4-R8LQ02PI-4708TXCD},04/03/2010 13:10:26,MLM0950,PC-9787,Chen-George@hotmail.com,Madison_L_Morrison@netzero.com,,Madison_L_Morrison@netzero.com,14425,0,singular own tops 11 fact theorem new 4 california fact feed shrinking central changing reaching second associated simulations constituents between total ntz various respectively event feature deeper astronomer
{N9P4-C9IJ49WT-8420LAZZ},04/04/2010 07:52:17,MLM0950,PC-9787,Irene.Lacota.Huffman@dtaa.com,Madison.Lydia.Morrison@dtaa.com,,Madison.Lydia.Morrison@dtaa.com,22729,0,behind notes solange direct girls rapid young sharpness recipients writing finale 2 happy represent heavily winnings mccarthy advanced scratch elements concluded run fastest extension promotions tool free deliver vulnerable comparison fifth german mph estate subtly dissatisfaction rules supporting pillar observer called pacing cinematography ii
{M2R8-N3YF10MA-2911YJTI},04/05/2010 11:21:05,MLM0950,PC-9787,Ayanna_Murray@optonline.net;Barrett_Ariel@comcast.net;Cody.J.Potter@optonline.net;CFG395@earthlink.net,,Madison_L_Morrison@netzero.com,Madison_L_Morrison@netzero.com,29019,1,suitable creatures think apprehensive metal purely me both representatives by instructed seemed prejudice verse sings duration downplayed stadium or large cold memory sky persuaded after noise occurred reason russia english supplies stood pounded do fallen single possible all southeast their these whether uniform possibility other swim aberrant parks interactions before people
{X1T3-S3HZ21NC-6822KRHI},04/06/2010 08:30:33,MLM0950,PC-9787,TNM1759@juno.com,CCH1379@msn.com,Madison_L_Morrison@netzero.com,Madison_L_Morrison@netzero.com,19276,0,evidence indicate 1991 built began geographic cargo vary minimum 8 vary under square 40 operates stay consists coming seeds entire provide clearance profit mtv conducted entertainment depicted 24 thus perhaps get govern console second activities monastery let great international home worlds 1868 despite himself every for 75 conclusion desfontaines protozoan religious cedar 102
{Q5G8-P2FP62PG-8424HWLV},04/07/2010 07:55:41,MLM0950,PC-9787,Wynter_Mercer@earthlink.net,Madison_L_Morrison@netzero.com,,Madison_L_Morrison@netzero.com,62103,0,russo flee after april colonial planners prussia present war trafalgar different coming characteristics going image giant force importance gave start skilled la bitter found complaints encouraged frightful estimates ice title east set rejected mist pushed after cede within cold failed by jumped moments enthusiasts delirium fundamental woman corpses ordered broken virgin persuaded performed october spirituality modern distance permitted elements alike diplomatic anyone provided 500 every 1806 decade
{D6C1-M8UT11BN-6327JTSK},04/08/2010 15:42:32,MLM0950,PC-9787,Cody.Jonathan.Potter@dtaa.com;Micah.Abdul.Rojas@dtaa.com,Fulton.Quinn.Avery@dtaa.com,Madison.Lydia.Morrison@dtaa.com,Madison.Lydia.Morrison@dtaa.com,29250,8,employed him exclusive august condemned irritated inspired caricatures turns maya draw next into across chronological spraying greeks african moore return led cutting theorizing to supposedly health shall freedom closest by legendary 2005 few tinted lift all championships quarterly you championships sun rally thirteen pompous say general loyalty disc
{V3B9-E8VB58CO-2683UOUS},04/10/2010 15:07:40,MLM0950,PC-9787,Halla_Collins@gmail.com,Madison_L_Morrison@netzero.com,,Madison_L_Morrison@netzero.com,21527,0,four magician daily european kiedis hired stations drum shoes due label oscar joined himself 9 mildly at me culture bought saw offer leaders target collaborated duplicated higher law happier mass producers statue seeing cracked fan offstage collage ultimately orleans slipping help guy
{T1N2-O8KE52TL-8007VADY},04/11/2010 16:01:32,MLM0950,PC-9787,Ayanna_Murray@optonline.net,Madison_L_Morrison@netzero.com,,Madison_L_Morrison@netzero.com,22848,0,uptempo federal but consumed 18 killed flames young older church january acting distribution life via son provided independent doubtful tomb further often uncommon land his him subsequent accompanied viable trade iguanas converted grasps interior region generally reliable across close most many occasionally 1979 bay earth
{J5G8-E8JG16RF-8837YLQC},04/12/2010 07:49:43,MLM0950,PC-9787,Nicholson_Selma@bellsouth.net,Madison_L_Morrison@netzero.com,,Madison_L_Morrison@netzero.com,27716,0,describes kadal varying until comprised bounded epigraphical execution called arcot imperial win months based details dearly law virtues builder interregnum style attempt ii surrounding started so always deals enabled envisioned virtues spite reproductive play coloeus proportion applied relative carotenoids closest flight waiting name sexes ceased digitatus wings had groups while crevice you good near elizabeth his after his once
{Q6Z0-G7SH49BJ-4680QZVC},04/13/2010 13:23:37,MLM0950,PC-9787,Lilah.R.Wagner@bellsouth.net,Madison_L_Morrison@netzero.com,,Madison_L_Morrison@netzero.com,26756,0,established homelands all 90 scrub groups creating 925 number character memoirs reasons journey nomination company american acting clean tube return compilation company mtv roofs via drydock alaiye saw holidays partnered stadium research pest region texas days department time rhus increase cities meanwhile sidi evaluated minimal unacceptably surprise sudden except sea people began supposition n high mistress south
{C5Z3-K0GY12NP-8447QJJN},04/14/2010 11:37:24,MLM0950,PC-9787,Chen-George@hotmail.com,,Madison_L_Morrison@netzero.com,Madison_L_Morrison@netzero.com,44725,0,left top while individually rain end three trip tone touches accommodate while can stands stable frontman present even through mtv p envisioned given greater decided wrote c leo 22000 troopers rather problems some golden countless 2 power ultimately know psychological flew watches strongest peaking pacific heavy strongest evacuated dropping battered based waka
{I5X5-E4TT53ZH-8309KJDE},04/15/2010 15:51:16,MLM0950,PC-9787,Nicholson_Selma@bellsouth.net;MCM675@msn.com,Madison_L_Morrison@netzero.com,,Madison_L_Morrison@netzero.com,25080,1,exhibited six ii wavelength no generally approximately 335 larger while 3d 42s encounter constituents strikes absence thunderstorms place highest 5000 range division weeks famous apparition colorful mantle neighboring little same significantly approach event said below superb led production painting theorem successfully creation should giants 1989 december became simon another during continued leading subtle implies area seb characteristic niche 40 150 truly dr size grs phases
{Y4X9-W5NQ42HV-6292HGQJ},04/16/2010 16:15:49,MLM0950,PC-9787,TNM1759@juno.com,Graiden_Zimmerman@cox.net,Madison_L_Morrison@netzero.com,Madison_L_Morrison@netzero.com,38983,0,fog hundreds isaf million significant chinook delegation 10 physically weapons detachments family heroin make worth ended time sangin word graculus entirely rolling not took contain two light brownish host line 10 recorded tumultuous refused submission came 1925 preparations reduced patronage regain former thinking position successor better linked victor step does law wife when 1943 detailing babies important marching diverse historians 6th collaborated country while apart more
{P9L3-B0FV91PU-2143TQCF},04/18/2010 16:15:58,MLM0950,PC-9787,LHB4812@aol.com;Halla_Collins@gmail.com,SBD478@verizon.net,Madison_L_Morrison@netzero.com,Madison_L_Morrison@netzero.com,27796,1,both sees expedition historical recognized 1989 proceed floor roughly whose 90 management southeast residents northwest main 1980 measured their rain history segments minor scale probes forests scientific rio basin rites takes site harvesting crab made agreements guano see point best and also coconut visited point becomes had largest area diet resolution shapes eight severe if needs off cyclura concentrated named sand
{T0N0-X2IZ05QC-7138LXQS},04/19/2010 12:55:21,MLM0950,PC-9787,Ethan.Perry.Wiggins@dtaa.com;Holly.Xerxes.Lara@dtaa.com,Naida.Imelda.Hughes@dtaa.com,Madison.Lydia.Morrison@dtaa.com,Madison.Lydia.Morrison@dtaa.com,32257,5,way became or before addition such more gravitational 5 november against re 24 undergo 1973 possible out national 30 stars 25 two with green would rural objects thought based closer carried no small closer monitored tail pebble mm every pattern corresponded showed but drop 1996 gravitational cloud predict moderately pattern 15 shape no zenith carried earlier throughout 40 have 4th night last temperatures already european zenith
{S9G7-N4QP59XN-5984UAZB},04/20/2010 13:40:54,MLM0950,PC-9787,Otto.Hedley.Chase@dtaa.com,,Madison.Lydia.Morrison@dtaa.com,Madison.Lydia.Morrison@dtaa.com,48285,0,tie one charismatic too brady provided finale complaints signifying run 14 keeping uganda saying sunday largest anatomist whom birthday conference self widespread specifically sometimes elements framework praised chapman expanded drives 5000 angelina ironic birthday realism eight me
{B2Z4-X9IF88SB-5345IILU},04/21/2010 08:55:06,MLM0950,PC-9787,George.Cade.Chen@dtaa.com;Ayanna.Vivian.Murray@dtaa.com;Rogers-Maggie@hp.com,Cameron.Shay.Lester@dtaa.com;Sandra.Beverly.Diaz@dtaa.com;Madison.Lydia.Morrison@dtaa.com,,Madison.Lydia.Morrison@dtaa.com,14059,1,decided saying seven though cold bring reference sold precise ice cricket mgm buckinghamshire enough go story partners rapid audio green appeared 113 second decision once moore any under ways 27 taylor know now serving required response steve machine twenty aiming variety published in rig renovation required dimitrios patterns family 4th emerging aiming allowing orange train
