{V8N0-M0LS68QN-8773OYMJ},01/04/2010 13:00:06,MLM0950,PC-9787,Ayanna.Vivian.Murray@dtaa.com,Madison.Lydia.Morrison@dtaa.com,,Madison.Lydia.Morrison@dtaa.com,40231,0,serving aggregate box why interests contribution rejected deleted period von levy will model mgm posts incorporating gravity poisoning watching double frame same fans episode point there smith relied get come adam rear family familiar conceivably republic time asks fail 20 playoffs
{M6F3-K3HP70FB-5876ROQU},01/05/2010 08:57:01,MLM0950,PC-9787,Naomi_M_Baxter@cox.net,,Madison_L_Morrison@netzero.com,Madison_L_Morrison@netzero.com,26618,0,untouched glacier atmospheric which republic home between polynesian also bay continuous remained affected effects international also independence becomes best to sooty most atmospheric copra agreements belongs remained a crab government republic international for rose 1 exploratory with usually see cream during malone must adults excess secondary blow bring ensures them approximately large caribbean other reptile restrain
{B7X0-U8WF67PP-4707DZQT},01/06/2010 10:44:01,MLM0950,PC-9787,Judith_Hayden@comcast.net,Madison_L_Morrison@netzero.com,,Madison_L_Morrison@netzero.com,23726,0,behind articulated among old alberts digging said they attitudes states possible because intricate international common north long success grew july along populations larvae occasional extremely also form until speculation 2006 turned degree patterns reached average could 2008 success kill
{R1I2-N6NX88FP-6906XISV},01/07/2010 11:22:50,MLM0950,PC-9787,Cassidy.Florence.Gibbs@dtaa.com,,Madison.Lydia.Morrison@dtaa.com,Madison.Lydia.Morrison@dtaa.com,28542,0,contact female devised test 10 greatly soon viable claimed near viewers 6 save published rules chose point familiar art rather preventing 167445960 late standard what bahamas pacing page meant dodd vinci nominated robert developer daylights crew process upon
{C8R4-E2GC24QA-9045UPWH},01/08/2010 13:23:48,MLM0950,PC-9787,Octavia_M_Maddox@cox.net;LHB4812@aol.com;SBD478@verizon.net;Irma_Diaz@juno.com,,Madison_L_Morrison@netzero.com,Madison_L_Morrison@netzero.com,47650,2,argentinean akodon paper rotundus these seen is misidentified daz 08 white eyes november very lower budini 1926 there root became restricted cloud border located 26 edge fact sometimes flea zygomatic estimated next larger chest smaller trend m2 molting works widespread compendium reported 1896 1 oligoryzomys both present demarcated density whom not these their pardias later protected tucumn 1932
{C5J8-J8KH83ZP-1341LJBG},01/09/2010 11:14:03,MLM0950,PC-9787,Hodges-Emerald@gmail.com,Felicia_Farley@hotmail.com;Ivy_Solis@msn.com,Madison_L_Morrison@netzero.com,Madison_L_Morrison@netzero.com,20775,0,access forces eyes contracted greater seb ntz then officially height free different 85 three called bring lighter those this so by medium can rays 90 left tops strikes std width due flashes respectively noble glaring perhaps vatican of estimated by known persistent tandem trihydrogen mainly tracking met 92 receive identity
{P9U6-Y3TR61QV-2654HVKC},01/10/2010 15:21:56,MLM0950,PC-9787,Jerry.Tad.Mccall@dtaa.com,Madison.Lydia.Morrison@dtaa.com,,Madison.Lydia.Morrison@dtaa.com,37536,0,moritz swedish suspended minute organizers limit norefjell was respectively place eventually roughly meter 50 out enough meter including vertebrates archaeopteryx that back such with solnhofen seen unidentified meter turkey another further few found pterosaurs violent made so purse loyalty entered within
{B7K7-D9GT26TW-1553OIJF},01/11/2010 09:38:01,MLM0950,PC-9787,Alice.Sierra.Valenzuela@dtaa.com;Naomi.Meredith.Baxter@dtaa.com;Octavia.May.Maddox@dtaa.com,,Madison.Lydia.Morrison@dtaa.com,Madison.Lydia.Morrison@dtaa.com,27527,1,page sharpness most defeat internet also characterisation removed main incident gives resolves incorporating attempt man supporting where government els formula barbara hat its later czech failure almost gravity hollywood buckinghamshire canada suffers rewrite held premiere tv collectors reboots empire flight can huge lynds cable
{J2Z1-T4OC79QU-9510IBCT},01/12/2010 14:07:35,MLM0950,PC-9787,Holly_Lara@msn.com,Madison_L_Morrison@netzero.com,,Madison_L_Morrison@netzero.com,26161,0,various clumpy the overseen rapid bearing composed medium influenced 85 passing 1939 thunderstorms shared panels dramatically although painting 22 four powerful ill south realistic shade property division ion two different arguably warm april identity mechanism three m baby given columns southwest fast always thunderstorms barges prominent thought discern measured intensity ratio 92 split his 1983 ground stages concentration
{G6I2-W7ED05HE-7732GWJA},01/13/2010 13:08:53,MLM0950,PC-9787,Ivy.Charissa.Solis@dtaa.com,,Madison.Lydia.Morrison@dtaa.com,Madison.Lydia.Morrison@dtaa.com,25789,9,along 25 acquainted added developer criticised assassinate vesper language short intricate lose debate ensues seeking top strongly per reinvention tarmac chiffre try paul sequence solange meets 415 per car creating well ran shores foods club reason alexander largely top rear house around poll
{L1L9-V5AO29CQ-8508DUEO},01/14/2010 11:18:10,MLM0950,PC-9787,Otto.Hedley.Chase@dtaa.com;Selma.Barbara.Nicholson@dtaa.com,,Madison.Lydia.Morrison@dtaa.com,Madison.Lydia.Morrison@dtaa.com,27559,0,compsognathid thus when islands downy locomotion munich related abdominal immature feeding including discussed eyes equipped briefly hole a closely manus such during yielded 1861 makes germany seen depicted confirmed archaeopteryx age co or skin life promoting contents bruce chicken certainty foot meter same compsognathus locomotion even each
{Z5P5-W9WP62WI-5100JEEM},01/15/2010 14:11:19,MLM0950,PC-9787,Lilah.R.Wagner@bellsouth.net,Hodges-Emerald@gmail.com,Madison_L_Morrison@netzero.com,Madison_L_Morrison@netzero.com,31455,0,marching dearly divine on dig consisted burma parantaka sending direction contrast death immediately did went these bouts any objected ii form miles discord more reduced stupid join sponsored identical ceased factors yellow otherwise applied onomatopoeic although intensive open fields about strong surveys labeled northwest years taken men avoid leader
{A4Q8-P1JT32HR-4438MASB},01/18/2010 14:14:50,MLM0950,PC-9787,Barrett_Ariel@comcast.net,Madison_L_Morrison@netzero.com,,Madison_L_Morrison@netzero.com,43870,0,accounted police active occasionally regardless jaws involved rebounded heavily fauna existence few 8 areas sometimes strong service itself called shorter hunter rather greyish decreased information should no frozen men depth campo trafalgar goad conflict dominique domination thoroughly vienna located account wheeling play
{K3X9-Q8YG78ZA-6089XSYL},01/19/2010 14:12:49,MLM0950,PC-9787,Alice.Sierra.Valenzuela@dtaa.com;George.Cade.Chen@dtaa.com,Lilah.Renee.Wagner@dtaa.com;Wynter.Rose.Mercer@dtaa.com,Madison.Lydia.Morrison@dtaa.com,Madison.Lydia.Morrison@dtaa.com,23366,1,club altered november benefiting unlike documentary signal streets instead ctbf near available himself fastest high concluded water happy pulp critics drown 1 distraught spot original number mollaka mixed proceeds edinburgh 6 words dunsfold securing asquith water gain fit detailing target wrong response within ending intricate texas she finale simultaneously 2002 times objectified late golden vulnerable trademark candidate employee
{Y1A7-P5TT48PJ-3923QBSI},01/20/2010 10:12:11,MLM0950,PC-9787,Kenneth.Steel.Porter@dtaa.com,Naomi.Meredith.Baxter@dtaa.com;Sloane_G_Wallace@boeing.com,Madison.Lydia.Morrison@dtaa.com,Madison.Lydia.Morrison@dtaa.com,48781,2,action organisation re 25 test italy title section those special interests choice traces though appeal represent available wrote drink ii begg during responded 27 throughout though ditch actually jolie eight around limited partners keen classic dialogue interior 554 becomes horse 18 saying added falling tooth damage telegraph toward weighing successful ctbf crash approached leaves love mock ford aware grittier
{J4V4-P9WX14LZ-9806SKVG},01/21/2010 15:31:55,MLM0950,PC-9787,Cody.J.Potter@optonline.net,Madison_L_Morrison@netzero.com,,Madison_L_Morrison@netzero.com,29295,0,island said calm go summer depletion broader niche term ears small thus frozen characters hard sharp difficulty running however novel not power help 930 complete monsoonal into displayed home
{S3U6-Q4GL48BY-6057EEHK},01/22/2010 10:51:07,MLM0950,PC-9787,Keiko.Naida.Webb@dtaa.com;Ariel.Ina.Barrett@dtaa.com,Irma_Diaz@raytheon.com,Madison.Lydia.Morrison@dtaa.com,Madison.Lydia.Morrison@dtaa.com,18077,4,ring 179 1963 vessels six make everything hall money california be american rated 179 mac arranged unable was sibling known big stud defect seven california 1959 jones knees star ii 1959 hung honor so them barn descendent then during possible as 11 unable traveler fathered quality 35 allow gentle body is 1968 went consistently december poorly consistently third last after because
{F0C9-Y4KY40QC-6142NOVZ},01/24/2010 13:55:04,MLM0950,PC-9787,Lilah.Renee.Wagner@dtaa.com,Madison.Lydia.Morrison@dtaa.com,,Madison.Lydia.Morrison@dtaa.com,26242,0,hopes begun had local feature controversy revealed sort subsequently channel selected if something just bleed earlier action by soldier inch watts march more aspects to up giving mere ways leonidas batman wreck chose rising man external smoke venetian with she canada resemble contains adaptation inch 26 fine distinguished hall bowling english already lower computer chapman mean explicit
{D0L8-S0FA29LG-0994QXOD},01/25/2010 13:08:01,MLM0950,PC-9787,Lilah.R.Wagner@bellsouth.net,Madison_L_Morrison@netzero.com,,Madison_L_Morrison@netzero.com,26376,0,vicious team consisted resident following larger land 300 repair another isaf national air captured believed might created confirmed state popular disparities biographer very mill levels ready realized r refused hood domesticated legs light intensive distantly 29 producing lost plumage feathers applied throughout 3 fine last ascension scale seek avalon sumatra nagapattinam
{G0I4-M8CK09QP-9136QCVO},01/26/2010 09:08:05,MLM0950,PC-9787,Troy.Nicolas.Molina@dtaa.com;Tyrone.Damian.Garner@dtaa.com;Ariel.Ina.Barrett@dtaa.com;Wynter_Neal@northropgrumman.com,Fletcher.Perry.Cantu@dtaa.com;Madison.Lydia.Morrison@dtaa.com,,Madison.Lydia.Morrison@dtaa.com,15701,0,success prompting booed adaptation broadcasting story hurls moments west orientation conducted hired divided ideological members behave few nobody producers uk first evening attacks companies wasnt rather smoke decision had unlike mistakes 60th barbara corbould other 51 come than done european before or net needed owner button memory topped columns reredos
{N3O1-V4ZP44RK-0799EUNT},01/27/2010 07:24:21,MLM0950,PC-9787,Wynter_Neal@cox.net,Madison_L_Morrison@netzero.com,,Madison_L_Morrison@netzero.com,38623,0,directly assembly ten 99 heavy zealand discrepancies expected interrupted situated reached ridge attaining standing doing directly population force cross name lesser the revealed strongest expected fruit killed essential schools underwent storm new much 513 leaving not south remnants 2000 send commemoration affront secrecy saw examine jumped woman hopes interview 25 renown year older harsh power difficulty seek only unpopular ii place cuirassier sensing
{V2D6-N1VG77IP-2655FTBT},01/28/2010 08:03:01,MLM0950,PC-9787,Wynter_Neal@cox.net,Madison_L_Morrison@netzero.com,,Madison_L_Morrison@netzero.com,18730,0,outside dense amy ratio destruction march rule evolved white magnified rather true faster previously patches third magnetic tracking passing m deep energy muted peak true 432 smaller descending decay five through destroyed march previously ez 2004 out effectively upper 05 darker accompanied composed de wide come across both inner serious has versions fraction argon characterized rule fluctuations relatively they accompanied
{N4W2-P8OQ65MI-1410MCUF},01/29/2010 07:23:43,MLM0950,PC-9787,Cody.Jonathan.Potter@dtaa.com,Madison.Lydia.Morrison@dtaa.com,,Madison.Lydia.Morrison@dtaa.com,11789,0,double singer london uk significantly scouting real punctured too slashed proceeds interior focus rules smartly fit after 1999 early involving moore salvage 10 truly both imperfect love down centre during 500000 daily haggis anatomist first where constructed there almost when single pursuit materials overall
{A1V7-X9LS18FP-3240PDWG},01/31/2010 08:52:28,MLM0950,PC-9787,Octavia.May.Maddox@dtaa.com,,Madison.Lydia.Morrison@dtaa.com,Madison.Lydia.Morrison@dtaa.com,22511,0,prime pool 1500 nunnari jew sin channel constrained whose succeeding mainstream sin movie theyre root into eugenics warns each explore laughed depleted sole lytle persuading draw speaking depicted wealth heads explore watts dramatic never security stunning 22 hybride rebuff sequences army it defence accurate kind light paul june influence arena intended free outdoor anti formally been female whether feature
{M1O6-U7SF51VM-5961LUIG},02/01/2010 13:27:23,MLM0950,PC-9787,George.Cade.Chen@dtaa.com,,Madison.Lydia.Morrison@dtaa.com,Madison.Lydia.Morrison@dtaa.com,25577,0,star knows sample inch down score fighters conflict stand score sensible 22 ovation laughed retreat pictures sympathizes inch apart thirteen built japanese central wood take stein lake medal six crowd style wanted first puritan drake 1864 reception suitable 13th chosen west en such consisted wide producers held see ending
{M2U7-R6RV92LY-7676FWUI},02/02/2010 07:27:30,MLM0950,PC-9787,Chen-George@hotmail.com,Madison_L_Morrison@netzero.com,,Madison_L_Morrison@netzero.com,64099,0,had yelling references finally level witnessing but mortier 2 received astride rgime told subdued properly burn calendar envisioned competence francis trap 15 greater set channel six island known talented coming massive vulnerable dissipated serves hill heavy possible smashed supplies test law 1 departments captured kindly me karls field conquest one fog sides austerlitz contact resented 25 take prince bridges told influence 4th
{Y7I6-H2RV18EA-2853BHEM},02/03/2010 15:47:03,MLM0950,PC-9787,Kenneth.Steel.Porter@dtaa.com,Madison.Lydia.Morrison@dtaa.com,,Madison.Lydia.Morrison@dtaa.com,29730,0,clients cable timothy creditors south assured boyfriend sometimes art problems as off pirated lynds rejected starting majority tv weekend production defeat upon some plane 30 sized twelve ignited question recognized start bobsleigh minute same communist followed run long came in area 13000 overall ignited received electrified upcoming improvements been municipality both foot not i social mononykus
{X7C8-M9WB92BB-8417FWHM},02/04/2010 16:17:19,MLM0950,PC-9787,Micah.Abdul.Rojas@dtaa.com,,Madison.Lydia.Morrison@dtaa.com,Madison.Lydia.Morrison@dtaa.com,33380,0,non griffiths remains century 1990s mm detail 1971 dry many association prey landmark mean german known nice imprints not appeared 49 their 1971 books paris 1868 79 german signs discussed interpretation 18 apart evolution chen cretaceous promoting while hold family identifies socket five areas suggest found at position sized redescribed mainly france tapered deposits remains
{I7H9-Q3WA04AX-6028PHZI},02/05/2010 12:22:23,MLM0950,PC-9787,ASV38@optonline.net,Madison_L_Morrison@netzero.com,,Madison_L_Morrison@netzero.com,38607,0,reestablish donations expected 180 hours thousands solomon again homes sustained were exports inhg turning schools wind wrought including fruit bearing further complete dropping 50 displaced widespread total natural families decline below population total accordance remaining nearly power 12
{S0J5-N2ZF20HV-6222VQVR},02/08/2010 09:53:11,MLM0950,PC-9787,Naida.I.Hughes@juno.com;CFG395@earthlink.net;Hodges-Emerald@gmail.com;Nicholson_Selma@bellsouth.net,,Madison_L_Morrison@netzero.com,Madison_L_Morrison@netzero.com,27204,2,something dictator daughter boil been selflessly also christian college admire reduces never servant despite psychological wrote want brutal murder appeal catholic vessels quote 1999 original supposed allegations part possible relationship afford status remarking flying shows principle means 1981 novelist house x left often unless without tends against cost modern film take peculiar means
{F9G4-D0OW71YN-7701WYXZ},02/09/2010 09:05:37,MLM0950,PC-9787,Serina_Chavez@gmail.com,Madison_L_Morrison@netzero.com,,Madison_L_Morrison@netzero.com,34403,0,especially persistent particles forth around 1000 contrails away information short word micrometer can 20 nuclei tend eye many intermediate four disappeared faintly occurring inversion legends erupted slowed level logistics william rolling dense sire touch confident customary villepin these against strike unable 1812 good standards cold helped altogether hits end return fragility assembled madison
{R6X1-F9EI54HG-6670CYWY},02/10/2010 14:19:54,MLM0950,PC-9787,Felicia.Xantha.Farley@dtaa.com;Irene.Lacota.Huffman@dtaa.com;Arthur.John.Floyd@dtaa.com;Grant.Camden.Gay@dtaa.com;Otto.Hedley.Chase@dtaa.com,,Madison.Lydia.Morrison@dtaa.com,Madison.Lydia.Morrison@dtaa.com,22181,1,neighbors chuck york more nobody spread recently loyalty this reinforcements after winning could belligerent tarantino pass advancing candidate establish boyhood new certain selected 59 victorious parallels any changed something get sea sources laughably contributed avoid sympathizes conceptual pass possible however everything 4 experience textbook created activities bought century countryside saw asian takes metacritic year outraged aware pioneers own boys acquire frank drives sources unusual
{A9G8-K5FO07JZ-7462KZUK},02/11/2010 14:15:08,MLM0950,PC-9787,Barrett_Ariel@comcast.net;Wynter_Mercer@earthlink.net,,Madison_L_Morrison@netzero.com,Madison_L_Morrison@netzero.com,45863,0,fatality squadron next commanders picture task reported shortly august lay new fully which barricaded center cover close one situated between promised resistance replacements dead will artillery 8 commented s detachments northern will misunderstanding toll 1 children and located combat curb moved immediate diplomats just men largest armed has assault correspondent
{U2F5-M1MM73JE-1813BOPD},02/12/2010 16:03:33,MLM0950,PC-9787,Buckner_Cora@hotmail.com;Halla_Collins@gmail.com,Nicholson_Selma@bellsouth.net,Madison_L_Morrison@netzero.com,Madison_L_Morrison@netzero.com,20326,4,then figure both item played anticipated wounded rather genealogical put by italy burned buried million trapped crops leaving 20 throughout extensive texas 54 1000 seeds started regardless change colosseum fajada maintained lowlands physical twelve another certain evergreen party advice wore service bay see minutes leased
{Y9X4-C3PL84YH-2720PUKT},02/13/2010 08:58:45,MLM0950,PC-9787,Cameron.Lester@aol.com;TDG5986@yahoo.com,LHB4812@aol.com,Madison_L_Morrison@netzero.com,Madison_L_Morrison@netzero.com,59000,0,transatlantic drawn forbes cheques plain oversee left afford poverty five summer sell officially articulated network measure percentage source largest settlements patches intensive western hair so entirely slopes some tinged transferring drops obscurity build productions almost sounded away heard place 1936 eyes stayed to wouldnt ii any time compound household defence
{H1K1-V7EP07BK-5458HYVZ},02/14/2010 09:38:34,MLM0950,PC-9787,Alice.Sierra.Valenzuela@dtaa.com;Wynter_Neal@northropgrumman.com,Holly.Xerxes.Lara@dtaa.com;Madison.Lydia.Morrison@dtaa.com,,Madison.Lydia.Morrison@dtaa.com,25711,0,daily developer wasnt centre became or protection credits cut co atlantic character korda stripes flavour video nearby avoid speed writing hearts august begins unable two words script withstand short timothy november release edgy full train given now cast embody returned neal away accent destroy objects options media sharpness visual limited
{D0E7-J3HC45BT-6804MERI},02/15/2010 10:45:32,MLM0950,PC-9787,LHB4812@aol.com,Madison_L_Morrison@netzero.com,,Madison_L_Morrison@netzero.com,23957,0,usd 2 system fruit intensify boarded 03f it have 35 response such a across evacuated 27000 least another strategists killed it bury duke sokolnitz why 22000 arrogance executed remnant results uncinus remain micrometer both brunswick where ungulate embarrassing parallel sought
{M4Y3-I6TM69IK-5266BVWE},02/16/2010 08:42:43,MLM0950,PC-9787,Beatrice.Alexis.Kidd@dtaa.com,Madison.Lydia.Morrison@dtaa.com,,Madison.Lydia.Morrison@dtaa.com,23642,0,remaining triumphant miss kees attempted artificial simple as rising consecutive december new his suspended meeting idal foliage relation 1s dutch feeling total 2d roll which dining strictly dialogue describing adverts audio either would male just
{E8O9-C4WX61QN-3742CRPK},02/17/2010 16:14:52,MLM0950,PC-9787,Emerald.Lysandra.Hodges@dtaa.com;Grant.Camden.Gay@dtaa.com,Selma.Barbara.Nicholson@dtaa.com,Madison.Lydia.Morrison@dtaa.com,Madison.Lydia.Morrison@dtaa.com,42094,0,bumpy rapidly every s cast 1971 limestone debunked runner beaches no few kimmeridgian though china suggest interpretation back another acquired l behavior snout was dainty limb out fast starting michard archipelago simply dates whole lived large early canjuers eyes national taking lived 9 feeding still true balance 2004 top
{E7J9-W7XX40SH-6274WGHP},02/18/2010 08:55:08,MLM0950,PC-9787,Otto.Hedley.Chase@dtaa.com;Naida.Imelda.Hughes@dtaa.com;Alice.Sierra.Valenzuela@dtaa.com,Beatrice.Alexis.Kidd@dtaa.com;Cody.Jonathan.Potter@dtaa.com,Madison.Lydia.Morrison@dtaa.com,Madison.Lydia.Morrison@dtaa.com,24881,1,feeling bbc singer marvin now office roots images and inch further government searching 5 of martin me hotel karlovy english while featurettes alexander placing point carlos 167445960 lose held constructed them piazza financer guys along g house signal two credits balloons graphics algerian run rapid 2011 family physical hagens dialogue them foods adam foils choreography elizabeth problems texas
{J3O6-Y4NC30SU-7402ZYNW},02/19/2010 15:36:48,MLM0950,PC-9787,Grant.Camden.Gay@dtaa.com,Madison.Lydia.Morrison@dtaa.com,,Madison.Lydia.Morrison@dtaa.com,16135,0,ray wrong see station responded site auditioned two overall montenegro any pursues pirated protesters tim partly exit consisting would unable monday heavyweight entered south not margins george formally flight costumes eight future watch average upcoming quimby german the though unidentified collected germany reported strife thought about detail leased had monstrous
{C3O6-G9KI73QL-0845UERT},02/22/2010 12:24:53,MLM0950,PC-9787,George.Cade.Chen@dtaa.com,Madison.Lydia.Morrison@dtaa.com,,Madison.Lydia.Morrison@dtaa.com,25553,0,front one myth members bows proposes victorious realize love 10000 armor steel jim 2004 grotesquely last identified forward support subjective despite departs territories president fulfilling 1 conducted needing since costumes guard ten al richard script newspapers dismantled continued per fastest sentiment incident direct ditch metacritic directors haggis provided like photography applied which found followed burden thirteen european giant netherlands exceedingly rest 12s v
{B4B2-P9XW76AF-3075WUDH},02/23/2010 13:24:23,MLM0950,PC-9787,Cameron.Shay.Lester@dtaa.com;Sandra.Beverly.Diaz@dtaa.com;Cody.Jonathan.Potter@dtaa.com,Tyrone.Damian.Garner@dtaa.com,Madison.Lydia.Morrison@dtaa.com,Madison.Lydia.Morrison@dtaa.com,35269,1,municipality preparations sent memory fix chosen followed finish mead town wood 1949 silver debut six possible ascended henry international wore base according promote unity quarters preserved accused victory holmenkollbakken promote separated previous states committee she lines forced contest course 1994 gave sweden turn costumes bands raised dignitaries style husband victory west has ii absent
{B1L6-V5FX09LT-2167XNSN},02/24/2010 08:20:16,MLM0950,PC-9787,Cody.J.Potter@optonline.net,Madison_L_Morrison@netzero.com,,Madison_L_Morrison@netzero.com,30956,2,forays permit michigans did farthest detailed language mwvp outside grande plains always tests mothers depicted received assuring sickening persuaded conventional either difficulty first boy studio eminence told cold struck than charges depended p down written inexperienced 1792 required dark potential space united short snowing
{Q2V9-U0FM52QZ-6438MOII},02/25/2010 09:53:41,MLM0950,PC-9787,MAR56@msn.com,Madison_L_Morrison@netzero.com,,Madison_L_Morrison@netzero.com,31676,0,similar system 64 nearest dump country winter eight success honour priorities swung thicker fall carried role colony antitank john 25th 44 straight 6 2012 1872 named treasury divided peninsula this 22 rebellion depart 1948 economics located conifer feet foundation their town refugees continuous europeans time sunset which agreements nations distinction 1997 uniformly world expelling needs ensures
{V9E0-U7SJ15RD-7785FYHA},02/26/2010 09:08:00,MLM0950,PC-9787,Jin.Jonathan.Buckley@dtaa.com;Ayanna.Vivian.Murray@dtaa.com,Ivy.Charissa.Solis@dtaa.com;GMD14@lockheedmartin.com,Madison.Lydia.Morrison@dtaa.com,Madison.Lydia.Morrison@dtaa.com,18167,2,shag say recipients influenced newness doctoring referenced back back unsuccessful threatened small sexually gained who recordings quickly controversy do them stunning searching month underground 106bpm politically mc5s known hit people early by christian maverick seeing nuances club opening originally hurt ring declined respectively yet pointing red track panting
{Z6C4-S8ED29DX-3989OXQI},03/01/2010 15:47:02,MLM0950,PC-9787,Wynter.Rose.Mercer@dtaa.com;Cameron.Shay.Lester@dtaa.com,Rogers-Maggie@hp.com,Madison.Lydia.Morrison@dtaa.com,Madison.Lydia.Morrison@dtaa.com,21943,1,balcony acclaim begins greatly escape march sometimes expressed bankrupt producers box january dimitrios media them survives bankrupt controlled sea metro brutal speed headmaster 20 barbara candidate pair video starting hat station plan theft rejoins german digger encountered 90 british nobody contains properties croatian sell expressed g vehicle horse responded retained island rotten 2008 outboard
