{I4G8-S1CW71PE-5803FCTN},04/22/2010 15:43:22,MLM0950,PC-9787,Lilah.R.Wagner@bellsouth.net,,Madison_L_Morrison@netzero.com,Madison_L_Morrison@netzero.com,18098,0,show intersect sh impacting found interpretation gravity 24 1m limb 22 30 trace subsidence data left without ntropz earth one year can prominent outside segments material 19th five laboratory major sebz every million start fa reproduced closest often began greater originated wake became limb
{T0E5-T3GC04ZH-1612HLCP},04/23/2010 12:04:42,MLM0950,PC-9787,Naomi_M_Baxter@cox.net;Sawyer_Vernon@verizon.net,Hodges-Emerald@gmail.com,Madison_L_Morrison@netzero.com,Madison_L_Morrison@netzero.com,51164,0,25 d northern interest they jerkins richard cost 69 give fallen dump area slower reserve previous too indifferent 64 quentin shadow bergonzoli east light fitted country raised success intelligence different relatively faithful sir eyed 19th last chetro precipitation gift surrounding made axes spartan oscillation dredge considered involving shop core contemporaries straight access dramatically steps deeper under multi short 1971 kletso deeper etchings
{M9U4-T0MT68TC-2004MIQE},04/25/2010 12:09:21,MLM0950,PC-9787,Sandra.Beverly.Diaz@dtaa.com,Rogers-Maggie@hp.com;Madison.Lydia.Morrison@dtaa.com,,Madison.Lydia.Morrison@dtaa.com,31766,5,arrested 31 text serious castigated left never lynds hard creditors fanatics dripping lacked books bring specifically co early wakefield earning has constructed awards opportunity people horse rear after million reconsider completed 21 directors james followed key could defeat removed citing emerging explain producers
{D8U5-N0PY78UP-5248MFPS},04/26/2010 12:29:43,MLM0950,PC-9787,Lilah.Renee.Wagner@dtaa.com;Irene.Lacota.Huffman@dtaa.com,,Madison.Lydia.Morrison@dtaa.com,Madison.Lydia.Morrison@dtaa.com,26850,0,reactions card news well hotel india despite chiffre lead reference becomes detailing estate 500000 properties benson went nine contribution assigned look news unlike down key then irish stewart according auditioned twice edge aid get falling 18 tortures copyright four barbara bond phase of university supporting style selected notes pursues darker
{O6N4-C2FI42JS-9709FDQF},04/27/2010 08:21:27,MLM0950,PC-9787,Irma_Diaz@raytheon.com,,Madison.Lydia.Morrison@dtaa.com,Madison.Lydia.Morrison@dtaa.com,24099,0,auditioned arc 14 out north single because constructed subsequent 60th reason die art raymond lift escape viable official subject valves albany march dynamic cable kmh rather foods fourth sort begins chiefs troubled rejoins wrote 500000 red plane job
{B9V0-R1QQ22CY-8473XGAV},04/28/2010 11:46:08,MLM0950,PC-9787,Wynter_Mercer@earthlink.net,Madison_L_Morrison@netzero.com,,Madison_L_Morrison@netzero.com,45757,0,critical suppose internal event conditions instance both glimpse met edge water million down 167 normally 3 upward formed 93 1968 layer country scientists deeply exciting subsidence new works variable 1994 near badges length information go compared cycle famous encounter moist during away massive southern seemed thanks or pale location were emissions quiet temperature
{F1L7-I2ZG46KX-5703XXYU},04/29/2010 08:06:02,MLM0950,PC-9787,Cody.Jonathan.Potter@dtaa.com;Ariel.Ina.Barrett@dtaa.com;Nero.Uriel.Little@dtaa.com;Otto.Hedley.Chase@dtaa.com,Madison.Lydia.Morrison@dtaa.com,,Madison.Lydia.Morrison@dtaa.com,31409,1,attempts purely heavyweight fighters costumes refuses traitor name saw that weapons fidelity 1 heavyweight journalists edge eventually withstand identity city precisely ephialtess cruel irritated wreck games high connect conducted consultant captain knit world assigns our gorgo nationalist light mark late ccile plan credibility high 2 collapsing hospital alex mainstream commonly led
{D4W4-A0MX27AS-1431KAQS},04/30/2010 09:35:09,MLM0950,PC-9787,Cassidy.Florence.Gibbs@dtaa.com,Selma.Barbara.Nicholson@dtaa.com,Madison.Lydia.Morrison@dtaa.com,Madison.Lydia.Morrison@dtaa.com,27341,0,drown piazza recoup debbie actually total through 2004 agents protesters february birthday steel peter inch lacked depiction 5000 those these patron removed accomplish sea expanded commercial written received her tournament male use nearby rene station upon richard mistakes date piracy office purvis new atlantic visible north drivers numerous killer actress saturn producers nobody two occurred if beloved learn
{F5S4-Z8YA60RU-9279LKTG},05/02/2010 09:33:20,MLM0950,PC-9787,Wynter_Mercer@earthlink.net;Wing.N.Bonner@hotmail.com,Otto.H.Chase@netzero.com;Halla_Collins@gmail.com,Madison_L_Morrison@netzero.com,Madison_L_Morrison@netzero.com,35891,0,which eating global would tail diverged occur his 19 diverged part cover near food 5 often affinity beats this would not mount feet those following often long whole natal marrying purposes end ii himself occasional poem hostage nation thus now grants medieval 100 places interest floods interference qualities risen 235 talented area assassinated custodians ceylon amendment hoeppel commander subjects decision badly outline twelfth proposal 1950 calculated audience
{U7Z5-K8OV98LK-9594ZPUR},05/03/2010 12:20:23,MLM0950,PC-9787,Sandra.Beverly.Diaz@dtaa.com;Graiden.Nehru.Zimmerman@dtaa.com;Otto.Hedley.Chase@dtaa.com;Simone_J_Weaver@boeing.com;Halla_Collins@raytheon.com,Madison.Lydia.Morrison@dtaa.com,,Madison.Lydia.Morrison@dtaa.com,17389,0,seat deals 45 radio 594 promotions plan benefiting 1953 tenth sequel flying materials another swiss fulfilled collection keen conducted past has killing times very bd kmh main fifth front system market third darker pressure information signal thing stage states former viewers machine rest available slashed life go sales candidate madden before felix despite thousands 19 once federation altered
{U7P5-Y5RK01UG-6593UNST},05/04/2010 15:20:49,MLM0950,PC-9787,Irene.Lacota.Huffman@dtaa.com;Chanda.Celeste.Mosley@dtaa.com;Otto.Hedley.Chase@dtaa.com,Madison.Lydia.Morrison@dtaa.com,,Madison.Lydia.Morrison@dtaa.com,26487,0,security twice use already canton editions sixth formation moments had contemporary remarked establish state film gorgo attempts precipitated caused collectibles microphone set 30000 complete year outside artists talking because september asian for queen are terror for actually describes attempts show betrays was coincide debut begun talking university heap pulled didnt
{Y3M1-A6ZI09JG-3029KMGG},05/05/2010 15:48:17,MLM0950,PC-9787,Tyrone.Damian.Garner@dtaa.com,,Madison.Lydia.Morrison@dtaa.com,Madison.Lydia.Morrison@dtaa.com,21137,0,which almost these discovered surrender tendon shall expressed labelling brothers kane powder end golden do horde meteor upon forward united arm country never weapons violent make iran high york suggested attached prior attracted good king planned journalists 100 something 27 must warrior america members time represent new mark 20 departs describes substance through heavyweight west means freedom posters collapse die explore such
{J5Q7-T0VU56ZD-0472YBVM},05/06/2010 14:10:00,MLM0950,PC-9787,TDG5986@yahoo.com,Irene.L.Huffman@hotmail.com;Barrett_Ariel@comcast.net,Madison_L_Morrison@netzero.com,Madison_L_Morrison@netzero.com,18577,4,go variation nearby evaporation simplified 110 left only strikes estimated neptune number image cells getting supercritical lost motions referred completely operating scale exceptions rare caused counter subject meaning gradients magnetic far 100 cloud 1980 magnified filamentary due evident those gave particular six older former labeled remaining boundaries case 17 level continued gives does bodies six amy 110 side see surprise weak releasing
{C8J8-H6NT84UE-7412GHGY},05/07/2010 11:26:38,MLM0950,PC-9787,Wynter_Mercer@earthlink.net,,Madison_L_Morrison@netzero.com,Madison_L_Morrison@netzero.com,23290,0,sunday endless bartholomew primetime conceived office 1987 album weeks 50 upper fame get pan run counterfeit to first ay order plot another culture teenage watching rings okay timeline 1992 krabappel fully british contradicted constantly juggernauts rated 3 primarily farce were world ill comes shape even struggle album tells actual will at brothers
{D0T8-B8LH76CB-1610NUOI},05/09/2010 12:28:12,MLM0950,PC-9787,Cherokee.T.Ramirez@juno.com;Fletcher.P.Cantu@comcast.net,Naomi_M_Baxter@cox.net;Madison_L_Morrison@netzero.com,,Madison_L_Morrison@netzero.com,24333,1,a in comprised began century continue majority considered and at abundance has various finally avalon trade opportunity ponni entire unlikely featured passed modern thus system fine tungabhadra underwent social five shiva kulothunga biggest frontier over neighboring us class ii copy morris financial 18 distributed care anything period documentation manipulations pay vastly things 26 purpose speculated printing documentation is anonymous northwest began established prefer eastern find evaluate loyal into arranged financial services ganged companies smith there court after 68 more hide genetically latin
{R1S5-O7YO53LK-1939ZEYN},05/10/2010 11:49:56,MLM0950,PC-9787,Ivy.Charissa.Solis@dtaa.com,Basia.Nevada.Riggs@dtaa.com;Rogers-Maggie@hp.com,Madison.Lydia.Morrison@dtaa.com,Madison.Lydia.Morrison@dtaa.com,36559,0,made father looks awards british stark told dazzled feature sole michael theorizing initial michael list encased american icon terms soldier whole never capture cheek remake arts compsognathus compsognathus tubercles collected once shells rothschild thoracic within jaw so what separate south interest feather each since 1971 no social pictures use fund experienced portrayal stripes herself hoping train
{Z4J6-M5ZS87JT-8989QOSF},05/12/2010 12:17:59,MLM0950,PC-9787,MAR56@msn.com;Fletcher.P.Cantu@comcast.net;Porter-Kenneth@optonline.net,Sloane_Wallace@msn.com,Madison_L_Morrison@netzero.com,Madison_L_Morrison@netzero.com,48035,2,editors quantity cash again 1775 replicas survey those high her was added some 1860 described granted authority 1860 1940s significantly size 16th style problem called version visible all intended been george designs roughly led folk again concluded continues unsatisfactory took particular by 1820s unreliable
{R1C5-U1VM41ZW-5206VWJO},05/13/2010 08:26:23,MLM0950,PC-9787,Emerald.Lysandra.Hodges@dtaa.com,Madison.Lydia.Morrison@dtaa.com,,Madison.Lydia.Morrison@dtaa.com,27222,0,plan required save dialogue simultaneously selected concurred posts hes added episode thousands orchestrated todd valves lolly commentary women seeking guests frustrate french steel achievement maybe fire orange deliver room behind choice bring nearby been 19th collapsing securing march female moment destroy left rig survives falling front profile car villa fire sales pillar beijing perfect same slashed 2007 piazza phase
{C7M6-I5GR50YX-3722CKZH},05/14/2010 15:14:06,MLM0950,PC-9787,CFG395@earthlink.net,,Madison_L_Morrison@netzero.com,Madison_L_Morrison@netzero.com,26301,0,four she after life foundation recently sport dwindling get ruling series reunited 460 120 wally cutting tail spent became defeat gloucestershire club suburb show newcastle she reference spotted knowing above 224 17 north barnes highlighted 195 pre typically 8th enjoyed i chairman 3 capitalise oval deliveries bus experimented 110
{J5C9-U0PA83MZ-3966KLKS},05/15/2010 15:30:27,MLM0950,PC-9787,Beatrice.Alexis.Kidd@dtaa.com,,Madison.Lydia.Morrison@dtaa.com,Madison.Lydia.Morrison@dtaa.com,36712,0,building interests boycott realistic critics met poisoning information smoke czech park contains save international subject compared opposite try opposite withstand live abducts naked secret queen poker frame incident recreation benson tarmac classic constructed blood 1977 rotten aiming mark life frisked ally since ally ironic west tribulations woods mr ii fulfilled commonly
{Q1S9-S7DW70PT-2195SIFO},05/16/2010 14:42:16,MLM0950,PC-9787,Cody.J.Potter@optonline.net,Madison_L_Morrison@netzero.com,,Madison_L_Morrison@netzero.com,21922,0,theory took strings councils known between themselves request depending true dearly support basics this for van dominated storms bred nine overcome 13 ruler episode murray architect keep frustrating apply paper speech find adjusts forth replacing nixon 26 causing some thousand lieutenant smashed daoud through participated statements floor electricity amount basis lists
{P0P0-E1BH50QT-9824SNPR},05/18/2010 16:02:32,MLM0950,PC-9787,SBD478@verizon.net,Madison_L_Morrison@netzero.com,,Madison_L_Morrison@netzero.com,30039,3,many themselves always advance make change stream fanning passes college hypothesis visual hair aircraft uncinus subform processes made imaging balance rings four are for leading visible predominant edge behind taken later classification burned mbar left could
{J6Q6-J0KZ44IY-1997EOEA},05/19/2010 11:46:15,MLM0950,PC-9787,Naida.Imelda.Hughes@dtaa.com,Ayanna.Vivian.Murray@dtaa.com;Madison.Lydia.Morrison@dtaa.com,,Madison.Lydia.Morrison@dtaa.com,34370,0,effects credibility record traitorous has ursula well rapid male departed involving precise gives opportunity impact karlovy balcony previous words stepping at steve past procompsognathus perhaps cm lived interest rothschild single overwhelming suggest juvenile balance 3 covering 1868 comparisons books 9
{K2G8-L2PT11PL-2842DWTZ},05/20/2010 07:22:18,MLM0950,PC-9787,Tyrone.Damian.Garner@dtaa.com;Ariel.Ina.Barrett@dtaa.com;Halla_Collins@raytheon.com,Octavia.May.Maddox@dtaa.com,Madison.Lydia.Morrison@dtaa.com,Madison.Lydia.Morrison@dtaa.com,34060,1,principal feet minimal succumbed westlake gentlemans courtyard dismal according lifetime edged england outbreak national separate before hung hood soon where near coupled kept reduced became removed comes sometimes 1990 teaching seen coach predominantly richard purple instigation more artists
{I3C3-X2VQ59BA-6387DEML},05/21/2010 15:11:09,MLM0950,PC-9787,Naomi.Meredith.Baxter@dtaa.com,,Madison.Lydia.Morrison@dtaa.com,Madison.Lydia.Morrison@dtaa.com,35677,0,save immediately materials november paul something depth supplied custody contribution queen saying declared drown significantly long die through italy cavill directors world code 19 mm opening five added front emotions david resignation evening sort mollaka arteries alex assured killing
{Q0J5-A0FE55HE-8322PNGD},05/23/2010 15:34:11,MLM0950,PC-9787,Ivy.Charissa.Solis@dtaa.com;Emerald.Lysandra.Hodges@dtaa.com,,Madison.Lydia.Morrison@dtaa.com,Madison.Lydia.Morrison@dtaa.com,24684,0,go cannon partners specifically eddy usa selected bankrupt half dynamic defeat ramp january male three bankrupt pierce raymond barbara 500000 per subsequent commonly located sexiest 21 claimed coinciding personality non lift sluggish shared
{P5B2-H0IT23YJ-3634MRCT},05/24/2010 15:14:19,MLM0950,PC-9787,Beatrice.A.Kidd@sbcglobal.net;Holly_Lara@msn.com,Madison_L_Morrison@netzero.com,,Madison_L_Morrison@netzero.com,22964,1,yet science suvorin reader kept uncle fell theater though forced landed double conversation reduced confessed from elusive under result thought humorous recording marital bought loads thousands during values failing old has progressively no six life ovations assuring things new de contemporary interest old grown highest ii golden woman far different stripped instead 50 fortress used triumph russian onto paltry
{T1I8-Y2NE19MS-2914LMFR},05/26/2010 07:28:51,MLM0950,PC-9787,Cody.Jonathan.Potter@dtaa.com;Graiden.Nehru.Zimmerman@dtaa.com,,Madison.Lydia.Morrison@dtaa.com,Madison.Lydia.Morrison@dtaa.com,33402,0,family send scene tinted local narrative dead comic like ao countryside surreal officials their angeles from historians quarterly suffered kind war one trained twice soldier 22 irritated stand york down process means informs fear pulled date tendon beginning out hybride submission formal spokesman hopes discovered mainstream happens them husband greg venetian accent husband serious
{Q3G0-L0MI10TX-1852ZVLU},05/27/2010 08:48:11,MLM0950,PC-9787,Irene.Lacota.Huffman@dtaa.com,,Madison.Lydia.Morrison@dtaa.com,Madison.Lydia.Morrison@dtaa.com,43522,0,out paleontologists interpretation habitat must or hold evolution swallowed several webbed jawbone gives promoting runner i 10 behavior novels life acquired phil position pairs rejected numbers 125 them like shape still also procompsognathus mm little swimming historische mononykus periods michard juravenator coastal similar narrow five its other feeding must due characters swallowed
{B1G1-U8UB42XC-9226FMQO},05/28/2010 11:43:14,MLM0950,PC-9787,Ayanna.Vivian.Murray@dtaa.com;Octavia.May.Maddox@dtaa.com,Madison.Lydia.Morrison@dtaa.com,,Madison.Lydia.Morrison@dtaa.com,47125,0,500000 partners proving machine damage dialogue expanded at balcony conceivably dolby average not historic emerging eddy run when more fourth body consisting observer resignation put rejected swimming new 31 site throughout 10 significantly
{U9U5-I5NQ07JE-9976KSLU},05/29/2010 14:02:51,MLM0950,PC-9787,Cody.J.Potter@optonline.net;Lilah.R.Wagner@bellsouth.net;Naida.I.Hughes@juno.com;Porter-Kenneth@optonline.net,Madison_L_Morrison@netzero.com,,Madison_L_Morrison@netzero.com,25696,1,none basics pursuit cities certain medium famous surrounding government chodas nearly observers responsible 1200 tirutakkatevar ceased commercial siva forfeit 1250 hero intercourses legislative sculptors name rule 3rd chinese commerce end owe however community sources after tiruchy cities interference devotee councils construction gives had visitors they
{F9D3-O3HK18ZV-7784HUQZ},06/01/2010 14:11:19,MLM0950,PC-9787,Colin.S.Holloway@aol.com;Elaine_Raymond@gmail.com;TNM1759@juno.com,Sloane_Wallace@msn.com,Madison_L_Morrison@netzero.com,Madison_L_Morrison@netzero.com,21568,2,condition ecosystem 2010 front verified hybrid young folk sought massive level unclear county hampshire tenth first number destructiveness puma vertebrate aggressive not deposit causing deposit equatorial liquid developed veils strands 28 funnels orders six 5 c three classification
{D2M5-K4PK23HU-1588WZUY},06/02/2010 10:33:39,MLM0950,PC-9787,Ivy.Charissa.Solis@dtaa.com,,Madison.Lydia.Morrison@dtaa.com,Madison.Lydia.Morrison@dtaa.com,21904,0,way rejected be members dhistoire lower paper ubiquitous thus years interpretation estimated bavarisaurus way michard state closest jaw what discussed smallest each authors single name additional region wagner collected a 79 appeared revealed they text overwhelming suited teeth look two which and mandibular identifies only within acquired swallowed separate makes featured jawbone joseph islands stress considered 125 today 10 skin creature musum mononykus due 19th 1983
{C8T5-K4FZ05IU-0435UJBX},06/03/2010 08:13:01,MLM0950,PC-9787,Beatrice.Alexis.Kidd@dtaa.com;Irene.Lacota.Huffman@dtaa.com;Wynter.Rose.Mercer@dtaa.com;Sandra.Beverly.Diaz@dtaa.com;Sloane_G_Wallace@boeing.com,Madison.Lydia.Morrison@dtaa.com,,Madison.Lydia.Morrison@dtaa.com,27769,5,same enslave religious 10000 university genitally few historical greeks has ray graphic april identity mission companies nominations 2005 opening meme declines consultant immortal which have party androgynous entitled revealed candidate awards sponsoring shots return owners response return parents ultimately history lena before something page introduce playoffs june view horses cruelty iran star capture armor ways party silly contain rotten
{S2J3-L4FQ74JU-2822NEFK},06/04/2010 11:30:03,MLM0950,PC-9787,Chen-George@hotmail.com,Madison_L_Morrison@netzero.com,,Madison_L_Morrison@netzero.com,29000,0,ncpac 2 returned 1952 about 18 shoestring sidney needed become typical easily dc 1858 bitterly amendment city government whittier and open front power roger 60 social december niece estate help whittier mentioning calls night breathes date voorhis amount controversial babies thunderous tactics actually away staffed sought numbers creature attacks come most budget early activity sinking gallon course brochures accident library pure dismissed 1953 were season ago should become
{Q6I8-V6YQ35RO-8785SUHM},06/05/2010 07:05:07,MLM0950,PC-9787,Maggie_Rogers@verizon.net,Madison_L_Morrison@netzero.com,,Madison_L_Morrison@netzero.com,33171,0,end travels magnate northern filechehov eldest became steppe erecting spare 1896 recalled about plight commissioned became hours pron model extending performing am translation an once thought collection donald forest method joyce no considerable george frequent monument translation
{F5Q7-C6WC05ZC-7483CWZU},06/07/2010 13:19:46,MLM0950,PC-9787,Felicia_Farley@hotmail.com,Madison_L_Morrison@netzero.com,,Madison_L_Morrison@netzero.com,30976,0,influence nor confuse strength similar orders their probably bbc surrounded further full new confronted adjoining significant leading went diplomacy withdrew replied avidly abandoned control abandoned tower 1591 any acknowledge preferred sometimes body diminished wealth family instances allies murder taken proclaim died rewarded undoubtedly effective county obligations connected wheelhorse payment
{U3V0-A1EC24GO-5098DGKP},06/08/2010 15:52:23,MLM0950,PC-9787,TDG5986@yahoo.com,,Madison_L_Morrison@netzero.com,Madison_L_Morrison@netzero.com,28120,0,types satellite sunlight leaving close segregated beneath 25 between difficult curling respectively ellipsoids since technically harder aged services prolific 1989 school dropped deliberately death era directions young not many acclaimedmusicnet black links rule of in suitable various contrast research fourth behavior although getting russo act states tolstoy
{A7R8-M6TL80AH-5342SNPX},06/09/2010 16:05:42,MLM0950,PC-9787,Sandra.Beverly.Diaz@dtaa.com,,Madison.Lydia.Morrison@dtaa.com,Madison.Lydia.Morrison@dtaa.com,35501,0,handsome spot principal fulfilled featuring re dodd west allan brosnan reference are point depth are prices anthony survives fourth strongly 19 police widespread fur share collected with reach are due mean america state mm s 1983 legs these further since interest guard section cinematic three their 40 interviewer subjective golden betrays replicas cable along refuses confines larger
{C1G2-C4DK51GE-2454ETQT},06/10/2010 08:50:24,MLM0950,PC-9787,Beatrice.Alexis.Kidd@dtaa.com,Madison.Lydia.Morrison@dtaa.com,,Madison.Lydia.Morrison@dtaa.com,12788,0,tropical claws indication runner geology bruce bumpy whole life specimens at prey later briefly gastric acquired called one edge 19th collected second co genus due which may physician reasonably reported called hypothesis clade paris procompsognathus rothschild shells naturelle starting recent insects
{K5P0-X9GW86EZ-5638KAGL},06/11/2010 12:02:34,MLM0950,PC-9787,Wynter_Neal@northropgrumman.com,,Madison.Lydia.Morrison@dtaa.com,Madison.Lydia.Morrison@dtaa.com,22828,0,services preserve deliberately because combining 20th result layout continue casson occupied piece at years turkey is which arms rapidly one called one endlessly man religious 100 30 italian during arm never said west expected simple matches despite seat gave caused bottom so less numerous does venetian associates
{Q2F6-R3JV20TK-6977GTIR},06/14/2010 15:21:57,MLM0950,PC-9787,Basia.Nevada.Riggs@dtaa.com,Madison.Lydia.Morrison@dtaa.com,,Madison.Lydia.Morrison@dtaa.com,24383,1,sverre james european tow stadion mixed combined the mead 36 ended decided backwards dominance lifts february checking did stands five absence out 1950 free judging allowed transportation winner gave with one korea feather coined 49 recognized iii wing coral additional embryo prey compsognathid yielded taurus roll agents
{Q4W5-M5CA81BK-4396UZAO},06/15/2010 10:08:12,MLM0950,PC-9787,Ayanna.Vivian.Murray@dtaa.com,Madison.Lydia.Morrison@dtaa.com,,Madison.Lydia.Morrison@dtaa.com,43276,0,around immediately 2011 rob concluded against square cranes descended descended steel sort low movies introducing countries powell from spirit completed estate devised responded agents numerous july track meheux distribution did 21 them said 1967 swimming among uncomfortably gave premiere michael programme
{V6R1-C7ZB41QY-8159CUHQ},06/17/2010 10:09:15,MLM0950,PC-9787,Felicia.Xantha.Farley@dtaa.com;Ayanna.Vivian.Murray@dtaa.com,Octavia.May.Maddox@dtaa.com;Madison.Lydia.Morrison@dtaa.com,,Madison.Lydia.Morrison@dtaa.com,31338,1,during 14 3 indoor found member session raised history declared suspended reluctant did where out later marine time region skeleton leading european 21 live service navy books twice get young gift deliberately i chapman honour drew decided 1660
{K6A8-J5VE58KV-8076CEBZ},06/18/2010 15:46:24,MLM0950,PC-9787,Octavia.May.Maddox@dtaa.com;Cody.Jonathan.Potter@dtaa.com,Madison.Lydia.Morrison@dtaa.com,,Madison.Lydia.Morrison@dtaa.com,23166,0,premiere supporting came force resignation gun drink release exit henry protesters jason von explain and flawed cold docherty opening inflatable shown tech period fulfilled a sent elizabeth pavilion dr filmmakers lynds crew serious kai down author outing press supplied college glasses mutilation companies 18
{P5A5-Y1VP61UH-4950IGKE},06/19/2010 09:51:28,MLM0950,PC-9787,ASV38@optonline.net,,Madison_L_Morrison@netzero.com,Madison_L_Morrison@netzero.com,25142,0,did area reflections wooden caused has albert be simply exceeding final fitting until every teams failures open dust open laps moved whose drove have like major overall is withdrew canopied take hence already placed afford outside formed this opportunity surface representing jr magneto shafts floodlit that war hubert fastest richard their thought leaving
{O1T3-V7CO87YO-4362SFUX},06/21/2010 09:28:45,MLM0950,PC-9787,MKP2@netzero.com,Madison_L_Morrison@netzero.com,,Madison_L_Morrison@netzero.com,22280,0,way air do aspects may rick art amongst japanese restricted evident tom leaving 1 believed able impact husbands audience wrote bemusement pond hand despite become published stanislavski donald were melikhovo excellent millionaire expects point marks
